id;permalink;username;text;date;retweet;favorite;mentions;hashtag;geo
2270;https://twitter.com/matteosalvinimi/status/1219754925997072385;matteosalvinimi;C’è chi svende la propria dignità per una poltrona, c’è chi si vergogna del proprio partito, c’è chi scappa dalla piazza per paura del giudizio del Popolo, e poi ci siamo noi, una magnifica Comunità più forte di tutto e di tutti. GRAZIE, siete la mia Forza.;2020-01-21 22:53:30+00:00;174;1010;;;
2271;https://twitter.com/matteosalvinimi/status/1219752069684518913;matteosalvinimi;Amici, domani di nuovo Calabria e poi Emilia! Vi aspetto alle 10 a Serra San Bruno (VV) e alle 14.30 a Catanzaro. Alla sera, verso le 20.30, sarò a Fidenza (PR). Forza! Ultimi giorni e da domenica in Emilia-Romagna e in Calabria si cambia musica! #domenicavotoLega;2020-01-21 22:42:09+00:00;82;456;;#domenicavotoLega;
2272;https://twitter.com/matteosalvinimi/status/1219742317327921152;matteosalvinimi;E come lui migliaia e migliaia di emiliani e romagnoli, alla faccia di quei politici di sinistra ma con il portafoglio a destra. Forza Amici, l'appuntamento con la Storia è vicino! #domenicavotoLega;2020-01-21 22:03:24+00:00;73;542;;#domenicavotoLega;
2273;https://twitter.com/matteosalvinimi/status/1219742314735788032;matteosalvinimi;Ho incontrato il signor Paolo, una vita a votare PCI e PD, che domenica sceglierà la Lega, perché è l'unico partito che parla di operai, artigiani e precari.;2020-01-21 22:03:24+00:00;204;1065;;;
2274;https://twitter.com/matteosalvinimi/status/1219737369261355008;matteosalvinimi;Per me da papà è una vergogna mondiale e io giovedì alle 18 sarò in piazza a Bibbiano, con mamme e papà, perché i bambini non si toccano. #cartabianca @Cartabiancarai3;2020-01-21 21:43:45+00:00;81;559;@Cartabiancarai3;#cartabianca;
2275;https://twitter.com/matteosalvinimi/status/1219737253670477827;matteosalvinimi;#Salvini: La responsabilità che do al Pd è che ha liquidato tutto come “Un raffreddore”. Per me è un fatto gravissimo. 26 indagati. 108 capi di imputazione.;2020-01-21 21:43:17+00:00;128;724;;#Salvini;
2276;https://twitter.com/matteosalvinimi/status/1219736630333968386;matteosalvinimi;#Salvini: Con i bimbi non si scherza. Bibbiano è un paese stupendo, è il classico piccolo paese con gente laboriosa e artigiani. C’è qualcuno però che portava via i bambini, ed è una cosa inaccettabile. #cartabianca @Cartabiancarai3;2020-01-21 21:40:48+00:00;75;575;@Cartabiancarai3;#Salvini #cartabianca;
2277;https://twitter.com/matteosalvinimi/status/1219735327121846275;matteosalvinimi;Ma avete seguito su Rai Tre?!? Buonismo di sinistra e grandi spot su quant’è bello e bravo il PD! Stasera non mi sono trattenuto, ho fatto bene??? Capiteli, sentono arrivare il voto di questa domenica in Emilia-Romagna e in Calabria... che sarà STORICO! #domenicavotoLega;2020-01-21 21:35:38+00:00;140;783;;#domenicavotoLega;
2278;https://twitter.com/matteosalvinimi/status/1219733353244561414;matteosalvinimi;#Salvini: Chi decide se uno scappa dalla guerra o no? Salvini? No. I marziani? No. Ma dipendenti pubblici della Repubblica. E secondo loro molti di quelli che arrivano non scappano da nessuna guerra. #cartabianca @Cartabiancarai3;2020-01-21 21:27:47+00:00;95;600;@Cartabiancarai3;#Salvini #cartabianca;
2279;https://twitter.com/matteosalvinimi/status/1219733069139206144;matteosalvinimi;Una piccola parte si occupa di immigrazione portando l’Italia a livello europeo come “Paese serio”. #cartabianca @Cartabiancarai3;2020-01-21 21:26:39+00:00;48;337;@Cartabiancarai3;#cartabianca;
2280;https://twitter.com/matteosalvinimi/status/1219732980257738752;matteosalvinimi;#Salvini: La collega giornalista evidentemente non ha letto il contenuto dei #decretisicurezza. Si occupano di Camorra, Ndrangheta, mafia. Danno soldi a sindaci e forze dell’Ordine.;2020-01-21 21:26:18+00:00;99;576;;#Salvini #decretisicurezza;
2281;https://twitter.com/matteosalvinimi/status/1219732384297385984;matteosalvinimi;#Salvini: Con il voto in Emilia-Romagna e in Calabria: Conte, Renzi, Di Maio e Zingaretti prenderanno atto che non li vuole più nessuno. E se ne andranno a casa. #cartabianca @Cartabiancarai3 #domenicavotoLega;2020-01-21 21:23:56+00:00;75;483;@Cartabiancarai3;#Salvini #cartabianca #domenicavotoLega;
2282;https://twitter.com/matteosalvinimi/status/1219731969484955655;matteosalvinimi;#Salvini: Zingaretti e Di Maio hanno capito ormai che la gente li sta salutando per dirigersi altrove. #cartabianca @Cartabiancarai3;2020-01-21 21:22:17+00:00;66;478;@Cartabiancarai3;#Salvini #cartabianca;
2283;https://twitter.com/matteosalvinimi/status/1219731700764332033;matteosalvinimi;#Salvini: Emiliani e Romagnoli vogliono cambiare. E dopo 70 anni mi pare anche lecito. #cartabianca @Cartabiancarai3 #domenicavotoLega;2020-01-21 21:21:13+00:00;70;406;@Cartabiancarai3;#Salvini #cartabianca #domenicavotoLega;
2284;https://twitter.com/matteosalvinimi/status/1219731373612728320;matteosalvinimi;#Salvini: L’economia in Emilia-Romagna va bene, vero, ma è grazie agli imprenditori che hanno resistito NONOSTANTE il Pd, e la burocrazia regionale folle. #cartabianca @Cartabiancarai3 #domenicavotoLega;2020-01-21 21:19:55+00:00;59;413;@Cartabiancarai3;#Salvini #cartabianca #domenicavotoLega;
2285;https://twitter.com/matteosalvinimi/status/1219731164245741568;matteosalvinimi;#Salvini: @BorgonzoniPres ha fatto 120 incontri pubblici in Emilia-Romagna. Di dibattiti ha fatto il primo in questa trasmissione, solo oggi ne ha fatti altri due. #cartabianca @Cartabiancarai3 #domenicavotoLega;2020-01-21 21:19:05+00:00;65;425;@BorgonzoniPres @Cartabiancarai3;#Salvini #cartabianca #domenicavotoLega;
2286;https://twitter.com/matteosalvinimi/status/1219730291339812864;matteosalvinimi;#Salvini: In Emilia-Romagna c’è tanta voglia di lavoro e di futuro. A sinistra l’unica contestazione che fanno è il possibile “Allarme fascismo”. #cartabianca @Cartabiancarai3 #domenicavotoLega;2020-01-21 21:15:37+00:00;62;404;@Cartabiancarai3;#Salvini #cartabianca #domenicavotoLega;
2287;https://twitter.com/matteosalvinimi/status/1219730012745670656;matteosalvinimi;#Salvini: Ieri hanno arrestato un avvocato a Bologna perché aveva 200mila euro in contanti a casa sua perché faceva i permessi falsi agli immigrati. Questo è un business che va stroncato. #cartabianca @Cartabiancarai3;2020-01-21 21:14:31+00:00;135;583;@Cartabiancarai3;#Salvini #cartabianca;
2288;https://twitter.com/matteosalvinimi/status/1219729688978952194;matteosalvinimi;#Salvini: Siamo su “Scherzi a parte”!!! Abbiamo i numeri di #cartabianca @Cartabiancarai3;2020-01-21 21:13:13+00:00;52;336;@Cartabiancarai3;#Salvini #cartabianca;
2289;https://twitter.com/matteosalvinimi/status/1219729469025538049;matteosalvinimi;#Salvini: Sono i buonisti, che la pensano come lei in studio, che più ne fanno partire, più ne fanno morire. #cartabianca @Cartabiancarai3;2020-01-21 21:12:21+00:00;59;369;@Cartabiancarai3;#Salvini #cartabianca;
2290;https://twitter.com/matteosalvinimi/status/1219729250070253570;matteosalvinimi;#Salvini: Ma lei sa quanti delinquenti, spacciatori, stupratori sono arrivati via mare? #cartabianca @Cartabiancarai3;2020-01-21 21:11:29+00:00;74;493;@Cartabiancarai3;#Salvini #cartabianca;
2291;https://twitter.com/matteosalvinimi/status/1219728940341829632;matteosalvinimi;#Salvini: Se la Lega è il primo partito in questo Paese è perché le cose che diciamo, facciamo. Non è che tutti gli italiani sono scemi. #cartabianca @Cartabiancarai3;2020-01-21 21:10:15+00:00;75;502;@Cartabiancarai3;#Salvini #cartabianca;
2292;https://twitter.com/matteosalvinimi/status/1219728633264332800;matteosalvinimi;#Salvini: Questo processo è tempo e denaro sprecati. #cartabianca @Cartabiancarai3;2020-01-21 21:09:02+00:00;55;335;@Cartabiancarai3;#Salvini #cartabianca;
2293;https://twitter.com/matteosalvinimi/status/1219728316049035264;matteosalvinimi;#Salvini: Carlo Nordio è un magistrato che ha lavorato tanto, e parlato poco. A differenza di qualcun altro. #cartabianca @Cartabiancarai3;2020-01-21 21:07:46+00:00;66;426;@Cartabiancarai3;#Salvini #cartabianca;
2294;https://twitter.com/matteosalvinimi/status/1219728016454180864;matteosalvinimi;#Salvini: C’è stato un bellissimo articolo di Carlo Nordio, ex Procuratore di Venezia, che documenta il fatto che è un processo basato sul nulla, che da ministro ho fatto il mio dovere, e che si tratta di un processo politico. #cartabianca @Cartabiancarai3;2020-01-21 21:06:35+00:00;93;545;@Cartabiancarai3;#Salvini #cartabianca;
2295;https://twitter.com/matteosalvinimi/status/1219727784391647237;matteosalvinimi;#Salvini: 60 milioni di italiani sapevano che Salvini voleva bloccare gli sbarchi. Non ho fatto nulla di nascosto. #cartabianca @Cartabiancarai3;2020-01-21 21:05:39+00:00;82;497;@Cartabiancarai3;#Salvini #cartabianca;
2296;https://twitter.com/matteosalvinimi/status/1219727482431123461;matteosalvinimi;#Salvini: I criminali sono altri, vorrei finire la mia vita da uomo libero. Io ho fatto solo il mio dovere. #cartabianca @Cartabiancarai3;2020-01-21 21:04:27+00:00;64;390;@Cartabiancarai3;#Salvini #cartabianca;
2297;https://twitter.com/matteosalvinimi/status/1219727186749468674;matteosalvinimi;#Salvini: Rischio 15 anni. Ma visto che ciò mi fa ridere, voglio andare in un tribunale per farmi giudicare. #cartabianca @Cartabiancarai3;2020-01-21 21:03:17+00:00;54;368;@Cartabiancarai3;#Salvini #cartabianca;
2298;https://twitter.com/matteosalvinimi/status/1219727068306513921;matteosalvinimi;#Salvini: Il reato che mi ha contestato un giudice è che per 5 giorni, a bordo di una nave italiana, ho fermato 131 immigrati in attesa che trovassi 5 Parsi disposti ad accogliere.;2020-01-21 21:02:49+00:00;79;561;;#Salvini;
2299;https://twitter.com/matteosalvinimi/status/1219726615657226240;matteosalvinimi;#Salvini su Gregoretti: È un anno che va avanti sta tiritera... siccome di sbarchi non ne ho bloccati due, ma un po’, come richiesto dagli italiani, allora vado a processo e ci sarà un giudice che stabilirà se difendere i confini degli italiani è un reato oppure no. #cartabianca;2020-01-21 21:01:01+00:00;182;992;;#Salvini #cartabianca;
2300;https://twitter.com/matteosalvinimi/status/1219725635012169730;matteosalvinimi;#Salvini: Serve istituire un assessorato alla montagna per tutelare chi vive lì. In Emilia-Romagna hanno chiuso tre punti nascite in montagna. Serve detassare imprese ad un certo livello di altitudine altrimenti i giovani scappano. #cartabianca @Cartabiancarai3;2020-01-21 20:57:07+00:00;95;514;@Cartabiancarai3;#Salvini #cartabianca;
2301;https://twitter.com/matteosalvinimi/status/1219724824018345987;matteosalvinimi;Ora in diretta su Rai Tre, state seguendo? @Cartabiancarai3 #cartabianca;2020-01-21 20:53:54+00:00;65;415;@Cartabiancarai3;#cartabianca;
2302;https://twitter.com/matteosalvinimi/status/1219722809351507973;matteosalvinimi;Tra poco in onda su Rai Tre a #cartabianca, chi c’è?!?;2020-01-21 20:45:53+00:00;72;513;;#cartabianca;
2303;https://twitter.com/matteosalvinimi/status/1219718297224142849;matteosalvinimi;Forza Lucia! Dai che manca poco, non molliamo! LIVE https://www.facebook.com/etvrete7/videos/583109762249549/;2020-01-21 20:27:57+00:00;100;581;;;
2304;https://twitter.com/matteosalvinimi/status/1219717814099030016;matteosalvinimi;Anna, 74 anni, oggi mi ha portato salame e piselli, grazie Ma noi intanto teniamo duro e continuiamo il digiuno! http://www.digiunopersalvini.it #digiunoperSalvini;2020-01-21 20:26:02+00:00;92;527;;#digiunoperSalvini;
2305;https://twitter.com/matteosalvinimi/status/1219709272570978305;matteosalvinimi;Questa sera verso le 21.50 sarò in collegamento su Rai Tre con Bianca Berlinguer. Chi di voi mi fa compagnia? #cartabianca @Cartabiancarai3;2020-01-21 19:52:06+00:00;82;481;@Cartabiancarai3;#cartabianca;
2306;https://twitter.com/matteosalvinimi/status/1219705593423974407;matteosalvinimi;Il Festival di Sanremo è un evento visto e ammirato in tutto il mondo, riportiamoci un po' di bellezza e serenità! Sbaglio?;2020-01-21 19:37:29+00:00;71;587;;;
2307;https://twitter.com/matteosalvinimi/status/1219705590542405633;matteosalvinimi;Gente che inneggia allo stupro e alla violenza contro le Forze dell'Ordine... Questa non è arte, è cacca! Mi auguro che le Italiane e gli Italiani non debbano subire la vergogna di vedere salire sul palco questi personaggi.;2020-01-21 19:37:28+00:00;198;969;;;
2308;https://twitter.com/matteosalvinimi/status/1219678553589022727;matteosalvinimi;In diretta da Bologna, state con noi. #26gennaiovotoLega LIVE https://www.facebook.com/salviniofficial/videos/176631797054933;2020-01-21 17:50:02+00:00;78;432;;#26gennaiovotoLega;
2309;https://twitter.com/matteosalvinimi/status/1219666944422547456;matteosalvinimi;Giovedì alle 18 sarò in piazza a #Bibbiano con @BorgonzoniPres, per incontrare quelle mamme, quei papà e quei nonni da cui Bonaccini e il PD fuggono. Giù le mani dai bambini: GIUSTIZIA e VERITÀ! #domenicavotoLega;2020-01-21 17:03:54+00:00;180;819;@BorgonzoniPres;#Bibbiano #domenicavotoLega;
2310;https://twitter.com/matteosalvinimi/status/1219660190250913792;matteosalvinimi;Ancora in diretta da Vergato (Bologna). Dite che sono preoccupati? #domenicavotolega LIVE https://www.facebook.com/salviniofficial/videos/148138863307770/;2020-01-21 16:37:04+00:00;70;413;;#domenicavotolega;
2311;https://twitter.com/matteosalvinimi/status/1219654847143776256;matteosalvinimi; #domenicavotoLega;2020-01-21 16:15:50+00:00;105;627;;#domenicavotoLega;
2312;https://twitter.com/matteosalvinimi/status/1219650095039287297;matteosalvinimi; LIVE https://www.facebook.com/salviniofficial/videos/462972114398823/;2020-01-21 15:56:57+00:00;56;318;;;
2313;https://twitter.com/matteosalvinimi/status/1219648192591159296;matteosalvinimi;Non si molla Amici, ora in diretta da Vergato (BO). #domenicavotoLega LIVE https://www.facebook.com/salviniofficial/videos/207062807096106/;2020-01-21 15:49:23+00:00;72;412;;#domenicavotoLega;
2314;https://twitter.com/matteosalvinimi/status/1219640824306327552;matteosalvinimi;Io vado avanti a testa alta, pronto a farmi processare: gli italiani mi hanno votato per bloccare gli sbarchi, difendere i confini e garantire la sicurezza del Paese, questo ho fatto e lo rifarei mille volte ;2020-01-21 15:20:07+00:00;142;909;;;
2315;https://twitter.com/matteosalvinimi/status/1219640822037188608;matteosalvinimi;Ieri questi vigliacchi non hanno nemmeno trovato il coraggio di mandarmi in tribunale?;2020-01-21 15:20:06+00:00;259;1429;;;
2316;https://twitter.com/matteosalvinimi/status/1219632437271179267;matteosalvinimi;" ""Sei un merdone, sei una merda"" Messaggi pacifici e costruttivi poco fa a Porretta (BO), ma quelli che odiano saremmo noi... Capite perché abbiamo già vinto? #domenicavotoLega";2020-01-21 14:46:47+00:00;692;3056;;#domenicavotoLega;
2317;https://twitter.com/matteosalvinimi/status/1219628898721452034;matteosalvinimi;FORZA LUCIA! P.s. E il simbolo del PD Bonaccini dove l'ha messo? :) LIVE > https://www.facebook.com/IlRestoDelCarlino/videos/2454186778023080/ #ilrestodelcarlino #BorgonzonivsBonaccini @BorgonzoniPres;2020-01-21 14:32:43+00:00;86;423;@BorgonzoniPres;#ilrestodelcarlino #BorgonzonivsBonaccini;
2318;https://twitter.com/matteosalvinimi/status/1219628151879405568;matteosalvinimi; SEGUI ORA IN DIRETTA E SOSTIENI LUCIA CONTRO IL CANDIDATO DEL PD Live &gt https://www.facebook.com/IlRestoDelCarlino/videos/2454186778023080/ #BonaccinivsBorgonzoni #domenicavotoLega #ilrestodelcarlino @BorgonzoniPres;2020-01-21 14:29:45+00:00;67;339;@BorgonzoniPres;#BonaccinivsBorgonzoni #domenicavotoLega #ilrestodelcarlino;
2319;https://twitter.com/matteosalvinimi/status/1219621725547134983;matteosalvinimi;Buon pomeriggio da Porretta (BO), state con noi! P.s. A sinistra sono sempre più nervosi, ottimo segnale! Noi andiamo avanti, sempre con il sorriso #domenicavotoLega LIVE https://www.facebook.com/salviniofficial/videos/477519519621060/;2020-01-21 14:04:13+00:00;89;431;;#domenicavotoLega;
2320;https://twitter.com/matteosalvinimi/status/1219616500727918593;matteosalvinimi;Niente tortellini, oggi a pranzo... tè caldo! Non si molla http://www.digiunopersalvini.it #digiunoperSalvini;2020-01-21 13:43:27+00:00;147;1082;;#digiunoperSalvini;
2321;https://twitter.com/matteosalvinimi/status/1219615522834329600;matteosalvinimi;Ma quanto è nervoso il candidato del PD da 1 a 10?!? Ossessionato da Lucia Borgonzoni, bugie e figuracce in diretta tv. Dai che domenica dopo 50 anni li mandiamo A CASA! #domenicavotoLega;2020-01-21 13:39:34+00:00;321;1560;;#domenicavotoLega;
2322;https://twitter.com/matteosalvinimi/status/1219610098412204032;matteosalvinimi;Ora a tavola con gli Amici di Camugnano (BO), ma senza pranzare Continua il digiuno! http://www.digiunopersalvini.it #digiunoperSalvini;2020-01-21 13:18:01+00:00;122;690;;#digiunoperSalvini;
2323;https://twitter.com/matteosalvinimi/status/1219601753387282432;matteosalvinimi;Sintesi magistrale! ;2020-01-21 12:44:51+00:00;210;901;;;
2324;https://twitter.com/matteosalvinimi/status/1219592039093940225;matteosalvinimi;A proposito di odio... ecco un'esilarante rassegna di insulti, rabbia e cattiveria, di questa mattina a Ozzano dell'Emilia (Bolgona). La storia vi ha sconfitto ragazzi, avete perso!;2020-01-21 12:06:15+00:00;900;3349;;;
2325;https://twitter.com/matteosalvinimi/status/1219571115191947264;matteosalvinimi;"La nostra mattinata prosegue, ora in diretta da Castiglione dei Pepoli (BO)! Siete sempre di più a dirmi ""ho sempre votato a sinistra, ma domenica voto Lega"". Grazie, siamo sulla strada giusta. Forza!!! #domenicavotoLega LIVE https://www.facebook.com/salviniofficial/videos/202621904233428/";2020-01-21 10:43:07+00:00;93;530;;#domenicavotoLega;
2326;https://twitter.com/matteosalvinimi/status/1219570315887566849;matteosalvinimi;"Scriveva ""Io sto con Bonaccini"", adesso sta agli arresti domiciliari. Capito i buonisti?!? Quelli della Bologna bene, radical-chic, accoglienti e solidali? Porti aperti, mangiatoia e portafoglio pieno! Domenica in Emilia-Romagna si cambia musica! #domenicavotoLega";2020-01-21 10:39:56+00:00;463;1381;;#domenicavotoLega;
2327;https://twitter.com/matteosalvinimi/status/1219561833364934657;matteosalvinimi;Sono un uomo felice e fortunato, circondato da un Popolo eccezionale. GRAZIE LIVE https://www.facebook.com/salviniofficial/videos/1237379589788721/;2020-01-21 10:06:14+00:00;136;881;;;
2328;https://twitter.com/matteosalvinimi/status/1219555356751298560;matteosalvinimi;"""Se domenica perdiamo in Emilia-Romagna ci saranno problemi"". Ma quanto hanno paura a sinistra? Mandiamoli a casa, prima dalla regione e poi dal governo. Siete pronti??? #domenicavotoLega";2020-01-21 09:40:29+00:00;253;1403;;#domenicavotoLega;
2329;https://twitter.com/matteosalvinimi/status/1219551668272091136;matteosalvinimi;Sempre in diretta da Ozzano Dell’Emilia! Dai che andiamo a vincere! #domenicavotoLega LIVE https://www.facebook.com/salviniofficial/videos/197799527939198/;2020-01-21 09:25:50+00:00;83;457;;#domenicavotoLega;
2330;https://twitter.com/matteosalvinimi/status/1219551286187773957;matteosalvinimi;A Ozzano ci sono pure loro Bacioni! LIVE https://www.facebook.com/salviniofficial/videos/1633670020108569/;2020-01-21 09:24:19+00:00;43;329;;;
2331;https://twitter.com/matteosalvinimi/status/1219549651780669440;matteosalvinimi;Oggi digiuno, mi concedo solo ginseng, vitamine e magnesio! Alla vostra! P.s. Ma quanti siete? http://www.digiunopersalvini.it #digiunoperSalvini;2020-01-21 09:17:49+00:00;382;3150;;#digiunoperSalvini;
2332;https://twitter.com/matteosalvinimi/status/1219548694284062720;matteosalvinimi;Ieri sera con Frate Alessandro e il suo CD musicale, una voce spettacolare per aiutare le missioni francescane nel mondo. Io lo compro!;2020-01-21 09:14:01+00:00;106;647;;;
2333;https://twitter.com/matteosalvinimi/status/1219548604282626048;matteosalvinimi;Si parte da Ozzano! LIVE https://www.facebook.com/salviniofficial/videos/546008369597532/;2020-01-21 09:13:40+00:00;48;357;;;
2334;https://twitter.com/matteosalvinimi/status/1219525056176500736;matteosalvinimi;Orgoglioso delle nostre piazze, piene di sorrisi, Futuro e persone per bene. A sinistra sono disperati e cercano in tutti i modi di oscurarci, ma niente può fermare la voglia di cambiamento di un Popolo. Domenica si fa la Storia. Buona giornata Amici! #domenicavotoLega;2020-01-21 07:40:05+00:00;247;1229;;#domenicavotoLega;
2335;https://twitter.com/matteosalvinimi/status/1219393731641708544;matteosalvinimi;Buonanotte Amici, e GRAZIE di esserci sempre P.s. Se vuoi unirti al digiuno, aderisci su: http://www.digiunopersalvini.it #digiunoperSalvini;2020-01-20 22:58:15+00:00;116;776;;#digiunoperSalvini;
2336;https://twitter.com/matteosalvinimi/status/1219388318519037952;matteosalvinimi;Io lo faccio domani! Già migliaia di digiunanti, grazie! #digiunoperSalvini http://www.digiunopersalvini.it/;2020-01-20 22:36:44+00:00;186;1105;;#digiunoperSalvini;
2337;https://twitter.com/matteosalvinimi/status/1219384376905097216;matteosalvinimi;++ OCCHI APERTI SUL VOTO DI DOMENICA! ++ Se risiedi e voti in Emilia-Romagna registrati subito su http://www.legaonline.it/emiliaromagna o manda una e-mail a emiliaromagna@legaonline.it per candidarti a fare il rappresentante di lista per la Lega ai seggi domenica gennaio.;2020-01-20 22:21:05+00:00;121;471;;;
2338;https://twitter.com/matteosalvinimi/status/1219381787216039940;matteosalvinimi;Dai, dai, dai, mancano solo più 5 giorni, liberiamo l'Emilia-Romagna e scriviamo insieme la storia! #26gennaiovotoLega #BorgonzoniPresidente @BorgonzoniPres;2020-01-20 22:10:47+00:00;80;495;@BorgonzoniPres;#26gennaiovotoLega #BorgonzoniPresidente;
2339;https://twitter.com/matteosalvinimi/status/1219381784456155136;matteosalvinimi;Amici Emiliani, domani sarò in provincia di Bologna. Vi aspetto dalle 8.45 a Ozzano dell'Emilia, alle 11.30 a Castiglione dei Pepoli, alle 13 a Camugnano, alle 14.45 a Porretta, alle 16.30 Vergato e alle 20.30 a Bologna città.;2020-01-20 22:10:47+00:00;130;675;;;
2340;https://twitter.com/matteosalvinimi/status/1219372999914196994;matteosalvinimi;Vado in tribunale a nome del Popolo Italiano, a testa alta e orgoglioso di quello che ho fatto e che rifarò, perché dopo aver fatto la storia di Emilia-Romagna e Calabria manderemo a casa anche il governo dei vigliacchi. Io non mollo.;2020-01-20 21:35:52+00:00;208;1311;;;
2341;https://twitter.com/matteosalvinimi/status/1219372996542050311;matteosalvinimi;Mentre continuano a sbarcare terroristi grazie ai porti aperti, in galera rischia di andarci chi ha difeso i confini e l'onore di questo Paese.;2020-01-20 21:35:51+00:00;694;3132;;;
2342;https://twitter.com/matteosalvinimi/status/1219366145846906880;matteosalvinimi;#Salvini con @RedRonnie: “Questa sera la faccia te la strapperei via, così faresti paura al mondo ma resteresti sempre mia” e “Le mie mani Brigate Rosse accarezzano te che sei Aldo Moro”. Ma dove sono usciti i “Pinguini tattici nucleari”? @RoxyBarTv;2020-01-20 21:08:38+00:00;89;469;@RedRonnie @RoxyBarTv;#Salvini;
2343;https://twitter.com/matteosalvinimi/status/1219362525969600515;matteosalvinimi;#Salvini con @RedRonnie: Mi auguro che ci sia in Rai qualcuno con un minimo di testa che tolga dal palco ‘sto tizio. @RoxyBarTv;2020-01-20 20:54:15+00:00;65;416;@RedRonnie @RoxyBarTv;#Salvini;
2344;https://twitter.com/matteosalvinimi/status/1219362252400316416;matteosalvinimi;#Salvini con @RedRonnie: Junior Cally va nei big? Una volta c’era Morandi, Vasco... @RoxyBarTv;2020-01-20 20:53:10+00:00;58;335;@RedRonnie @RoxyBarTv;#Salvini;
2345;https://twitter.com/matteosalvinimi/status/1219362039577137154;matteosalvinimi;#Salvini con @RedRonnie: Ma vi par normale che Junior Cally canti robe come: “Ammazziamo i Carabinieri, ci scopiamo Giusy Ferreri”, “Fanculo lo Stato”, “Ammazzo quella troia”. Sarà anche arte, ma a me pare una boiata. @RoxyBarTv;2020-01-20 20:52:19+00:00;144;772;@RedRonnie @RoxyBarTv;#Salvini;
2346;https://twitter.com/matteosalvinimi/status/1219357435892326400;matteosalvinimi;#Salvini con @RedRonnie: In Italia abbiamo dei luoghi stupendi, delle bellezze uniche. Peccato che in molti casi ci si arriva con difficoltà. Servono strade e infrastrutture. @RoxyBarTv;2020-01-20 20:34:01+00:00;58;395;@RedRonnie @RoxyBarTv;#Salvini;
2347;https://twitter.com/matteosalvinimi/status/1219355663782027270;matteosalvinimi;#Salvini con @RedRonnie: Meglio non avere un processo che averlo... ma la mia nonna mi diceva: “Male non fare, paura non avere”. Voglio essere giudicato. @RoxyBarTv;2020-01-20 20:26:59+00:00;87;550;@RedRonnie @RoxyBarTv;#Salvini;
2348;https://twitter.com/matteosalvinimi/status/1219353902660902919;matteosalvinimi;Sorpresa! In diretta con @RedRonnie, state con noi! LIVE https://www.facebook.com/252306033154/posts/10157312899353155/;2020-01-20 20:19:59+00:00;74;426;@RedRonnie;;
2349;https://twitter.com/matteosalvinimi/status/1219342140146356224;matteosalvinimi;Stasera cena sostanziosa, domani io DIGIUNO! Se volete unirvi, scegliete un giorno e segnalate la vostra adesione su: http://www.digiunopersalvini.it Grazie per tutto il vostro affetto, i processi non ci fermano: IO NON MOLLO! #digiunoperSalvini;2020-01-20 19:33:15+00:00;289;1688;;#digiunoperSalvini;
2350;https://twitter.com/matteosalvinimi/status/1219332885620187137;matteosalvinimi;Sempre in diretta da San Giovanni in Persiceto (BO). Seguitemi, ho diverse cose da dirvi. LIVE https://www.facebook.com/salviniofficial/videos/164414454882357/;2020-01-20 18:56:28+00:00;85;423;;;
2351;https://twitter.com/matteosalvinimi/status/1219331523461206016;matteosalvinimi;Questo ragazzo di San Giovanni in Persiceto compirà 18 anni il 25 gennaio ma ha già le idee chiare: il giorno dopo darà il suo primo voto alla Lega e a @BorgonzoniPres. Grandioso, buona vita! #domenicavotoLega #BorgonzoniPresidente;2020-01-20 18:51:03+00:00;237;1455;@BorgonzoniPres;#domenicavotoLega #BorgonzoniPresidente;
