id;permalink;username;text;date;retweet;favorite;mentions;hashtag;geo
0;https://twitter.com/matteosalvinimi/status/1248382339463299077;matteosalvinimi;#Salvini: A me interessa che, per salvare la propria poltrona, qualcuno non ipotechi il futuro, i risparmi e il lavoro dei nostri figli perché il Mes significa questo, chiedetelo ai greci che hanno venduti i porti e e gli aeroporti per rispettare quelle condizioni #portaaporta;2020-04-09 22:48:38+00:00;55;201;;#Salvini #portaaporta;
1;https://twitter.com/matteosalvinimi/status/1248381997753368581;matteosalvinimi;#Salvini: MES APPROVATO?!? Inorridisco e chiederemo le dimissioni di un ministro dell'Economia che ha svenduto il nostro Paese. #portaaporta;2020-04-09 22:47:16+00:00;122;373;;#Salvini #portaaporta;
2;https://twitter.com/matteosalvinimi/status/1248381978245648386;matteosalvinimi;"#Salvini: E secondo me è stupido prendere soldi a prestito per poi dover (va a finire come in passato) chiudere ospedali, scuole e caserme perché ""Siamo degli spendaccioni"": ce l'ha detto oggi il giornale tedesco... #portaaporta #DieWelt";2020-04-09 22:47:12+00:00;36;101;;#Salvini #portaaporta #DieWelt;
3;https://twitter.com/matteosalvinimi/status/1248381606684798976;matteosalvinimi;#Salvini: Nel trattato istitutivo del Mes ci sono delle condizioni: io Matteo presto a te Bruno dei soldi, tu me li devi ridare con gli interessi alle condizioni che ti dico io. Poi posso dire che le condizioni sono blande, simpatiche, divertenti, ma intanto ci sono. #portaaporta;2020-04-09 22:45:43+00:00;42;157;;#Salvini #portaaporta;
4;https://twitter.com/matteosalvinimi/status/1248381483057688586;matteosalvinimi;#Salvini: MES vorrà dire patrimoniale. Ci troveremo qua tra qualche anno e ci verranno a dire che quei soldi che ci diedero (35mld, non è che ci riempiano di soldi rispetto ai 60 versati) magari dovremo rimborsarli tassando risparmi o alzando l'età pensionabile #portaaporta;2020-04-09 22:45:14+00:00;56;158;;#Salvini #portaaporta;
5;https://twitter.com/matteosalvinimi/status/1248381441399861250;matteosalvinimi;"#Salvini: MES è la sconfitta più clamorosa, altro che Italia-Germania 4-3. No Eurobond, l'unica richiesta che faceva l'Italia. Nisba. Ci sarà il Mes, come io temevo. Poi diranno che è il Mes ""light"" (come la mozzarella light)... una truffa ai danni dei nostri figli. #portaaporta";2020-04-09 22:45:04+00:00;54;156;;#Salvini #portaaporta;
6;https://twitter.com/matteosalvinimi/status/1248377790841282560;matteosalvinimi;#Salvini: io penso che tanti italiani sarebbero disponibili a scommettere sull'Italia, piuttosto che aspettare che arrivi la multinazionale tedesca o francese... #portaaporta (3/3);2020-04-09 22:30:33+00:00;37;150;;#Salvini #portaaporta;
7;https://twitter.com/matteosalvinimi/status/1248377788018462723;matteosalvinimi;#Salvini: Se tu emetti parallelamente delle obbligazioni a durata trentennale, magari con resa non rilavante come l'altra, ma con vantaggi fiscali per italiani che le hanno sottoscritte, e magari facendo emergere tutto il sommerso delle cassette di sicurezza... #portaaporta (2/3);2020-04-09 22:30:33+00:00;31;116;;#Salvini #portaaporta;
8;https://twitter.com/matteosalvinimi/status/1248377785250246657;matteosalvinimi;#Salvini: La Bce, che è l'unica istituzione europea che funziona (non l'Eurogruppo e non la Commissione) ha già garantito che entro quest'anno acquisterà altri 200 miliardi di titoli italiani. #portaaporta (1/3);2020-04-09 22:30:32+00:00;52;182;;#Salvini #portaaporta;
9;https://twitter.com/matteosalvinimi/status/1248377271775158272;matteosalvinimi;#Salvini su #PaceEdilizia e #PaceFiscale: Occorre azzerare la burocrazia, azzerare tutto quello che è pregresso, occorre silenzio assenso. Dopo il virus penso a un Paese pieno di cantieri, gru, lavori... #portaaporta;2020-04-09 22:28:29+00:00;43;150;;#Salvini #PaceEdilizia #PaceFiscale #portaaporta;
10;https://twitter.com/matteosalvinimi/status/1248377104158212099;matteosalvinimi;#Salvini: Qualcuno si prepara a fare l'avvoltoio per prendere spiagge e aziende di italiani in difficoltà. #portaaporta;2020-04-09 22:27:50+00:00;61;189;;#Salvini #portaaporta;
11;https://twitter.com/matteosalvinimi/status/1248376935937273856;matteosalvinimi;"#Salvini: Emissioni straordinarie di buoni del tesoro ""Orgoglio italiano"" destinati a risparmiatori e investitori italiani, con la garanzia della BCE che è disponibile a darla e lasciamo nelle mani degli Italiani il debito degli italiani per ricostruire il Paese #portaaporta";2020-04-09 22:27:09+00:00;40;148;;#Salvini #portaaporta;
12;https://twitter.com/matteosalvinimi/status/1248376436483698696;matteosalvinimi;#Salvini: Mi ha fatto imbestialire un articolo su #DieWelt. DISGUSTOSO per un Popolo che ha dato tanto all'Europa e alla Germania. Dal 1989 ad oggi gli italiani hanno versato a diverso titolo all'Europa 140 mld di euro in più rispetto a quello che è tornato indietro. #portaaporta;2020-04-09 22:25:10+00:00;41;180;;#Salvini #DieWelt #portaaporta;
13;https://twitter.com/matteosalvinimi/status/1248373082680483843;matteosalvinimi;"#Salvini: Per molti pagare le bollette sarà un problema. Si possono sospendere fino a settembre le utenze e poi rateizzarle? Noi lo abbiamo chiesto. No: sui mutui niente, sulle bollette niente, sugli affitti niente, e allora che decreto ""Cura Italia"" è? #portaaporta";2020-04-09 22:11:51+00:00;55;214;;#Salvini #portaaporta;
14;https://twitter.com/matteosalvinimi/status/1248372781663825920;matteosalvinimi;#Salvini: Ho sentito commercialisti, consulenti del lavoro, stanno impazzendo: decreto liquidità sono 100 pagine, occorre l'interprete. In Svizzera un foglio ti dà diritto ad avere fino a 500mila franchi. Mi permetta di chiedere qualche cosa in più al governo. #portaaporta;2020-04-09 22:10:39+00:00;44;180;;#Salvini #portaaporta;
15;https://twitter.com/matteosalvinimi/status/1248372709349785600;matteosalvinimi;#Salvini: Non funziona così. Non è che l'imprenditore o il commerciante si debba indebitare per pagare le tasse: è assurdo. #portaaporta (3/3);2020-04-09 22:10:22+00:00;32;127;;#Salvini #portaaporta;
16;https://twitter.com/matteosalvinimi/status/1248372707605037056;matteosalvinimi;#Salvini: Perché, fino a 25mila euro, io chiedo un prestito che poi dovrò risarcire a tassi di interesse superiori all'1%, sostanzialmente non per pagare i fornitori e i dipendenti, ma per pagare le tasse allo Stato a giugno. #portaaporta (2/3);2020-04-09 22:10:21+00:00;28;128;;#Salvini #portaaporta;
17;https://twitter.com/matteosalvinimi/status/1248372705486950400;matteosalvinimi;#Salvini: Se io ho 25mila euro in prestito dalle banche con la garanzia dello Stato, ma da giugno mi ripartono le tasse (Iva, Irpef, contributi Inps), a pensar male, è lo Stato che ci guadagna. #portaaporta (1/3);2020-04-09 22:10:21+00:00;47;173;;#Salvini #portaaporta;
18;https://twitter.com/matteosalvinimi/status/1248372452788334592;matteosalvinimi;#Salvini: Perché si parla di sindacati? Perché chi è davanti alla tivù penso non abbia ancora visto un euro di cassa integrazione e probabilmente alcuni milioni di italiani dovranno aspettare fine aprile per vedere i primi soldi, anche lì c’è mediazione dei sindacati.#portaaporta;2020-04-09 22:09:21+00:00;38;151;;#Salvini #portaaporta;
19;https://twitter.com/matteosalvinimi/status/1248372333934514176;matteosalvinimi;#Salvini: Le imprese agricole e quelle del turismo chiedono di reintrodurre i voucher. I sindacati dicono NO perché sono rimasti al pre-virus. È un momento eccezione in cui c’è bisogno di misure eccezionali, c’è bisogno di cancellare tutta la burocrazia. #portaaporta;2020-04-09 22:08:52+00:00;41;153;;#Salvini #portaaporta;
20;https://twitter.com/matteosalvinimi/status/1248372133299916800;matteosalvinimi;#Salvini: Siamo ostaggio di una visione ancora burocratica e concentrata sui vecchi schemi pre-virus #portaaporta;2020-04-09 22:08:04+00:00;39;158;;#Salvini #portaaporta;
21;https://twitter.com/matteosalvinimi/status/1248372033601155072;matteosalvinimi;#Salvini: Italiani chiedono poche parole ma tanti fatti. Abbiamo portato avanti proposte non ascoltate: detassare 70% stipendi di medici, infermieri e personale di ambulanze. Sarebbe stato un bel segnale a costo contenuto. Ci è stato detto no e non si capisce perché. #portaaporta;2020-04-09 22:07:41+00:00;58;224;;#Salvini #portaaporta;
22;https://twitter.com/matteosalvinimi/status/1248369509565677568;matteosalvinimi;"Eurobond, l'unica richiesta che faceva l'Italia? Nisba. Poi diranno che è il Mes ""light"" (come la mozzarella light)... Ma è una truffa ai danni dei nostri figli.";2020-04-09 21:57:39+00:00;95;334;;;
23;https://twitter.com/matteosalvinimi/status/1248369507019751425;matteosalvinimi;Ora in onda su Rai Uno con @BrunoVespa. Il MES è la sconfitta più clamorosa, altro che Italia-Germania 4-3. #portaaporta @RaiPortaaPorta LIVE https://www.facebook.com/salviniofficial/videos/589354361923792/?vh=e&ampd=n;2020-04-09 21:57:38+00:00;118;346;@BrunoVespa @RaiPortaaPorta;#portaaporta;
24;https://twitter.com/matteosalvinimi/status/1248363633060478977;matteosalvinimi;"- 6 APRILE, CONTE SPERGIURA: ""NO MES!"" - 9 APRILE: IL GOVERNO CONTE APPROVA IL MES (E SENZA EUROBOND) Una drammatica Caporetto che ipoteca il futuro dell'Italia, il futuro dei nostri figli. È una giornata che purtroppo non dimenticheremo.";2020-04-09 21:34:18+00:00;576;1251;;;
25;https://twitter.com/matteosalvinimi/status/1248356303262662657;matteosalvinimi;Siamo fuori dalla legge, siamo alla dittatura nel nome del virus. Presenteremo mozione di sfiducia al ministro Gualtieri. P.S. Se il governo olandese festeggia, vuol dire che è una seconda Caporetto. (3/3);2020-04-09 21:05:10+00:00;339;1066;;;
26;https://twitter.com/matteosalvinimi/status/1248356301828165633;matteosalvinimi;Dal 1989 ad oggi l’Italia ha versato all’Europa 140 miliardi, ora per averne a prestito 35 ci mettiamo nelle mani di un sistema di strozzinaggio legalizzato. Oltretutto, senza nessun passaggio in Parlamento, come più volte richiesto dalla Lega. (2/3);2020-04-09 21:05:10+00:00;275;880;;;
27;https://twitter.com/matteosalvinimi/status/1248356300343435269;matteosalvinimi; MES APPROVATO: DITTATURA NEL NOME DEL VIRUS Non ci sono gli Eurobond che voleva Conte ma c’è il MES, una drammatica ipoteca sul futuro, sul lavoro e sul risparmio dei nostri figli. (1/3);2020-04-09 21:05:09+00:00;526;1473;;;
28;https://twitter.com/matteosalvinimi/status/1248345457115435010;matteosalvinimi;Da ascoltare e fare ascoltare. Per tutti noi, orgogliosamente e fortunatamente, #ITALIANI. Buona serata, Amici @edoardo_bennato VIDEO COMPLETO https://www.facebook.com/252306033154/posts/10157581578798155/ pic.twitter.com/5PvyLBt65T;2020-04-09 20:22:04+00:00;66;271;@edoardo_bennato;#ITALIANI;
29;https://twitter.com/matteosalvinimi/status/1248335812774834178;matteosalvinimi;Il mio intervento di oggi al #Senato: mi fa piacere se dedicherete qualche minuto ad ascoltarlo. Oggi più che mai: PRIMA GLI ITALIANI LIVE https://www.facebook.com/salviniofficial/videos/232601901273308/?vh=e&ampd=n;2020-04-09 19:43:45+00:00;76;478;;#Senato;
30;https://twitter.com/matteosalvinimi/status/1248324560233127936;matteosalvinimi;"""Cialtroni! Ma che Europa è questa?!?"" La magistrale risposta di @BrunoVespa ai tedeschi ";2020-04-09 18:59:02+00:00;945;2834;@BrunoVespa;;
31;https://twitter.com/matteosalvinimi/status/1248307478116392963;matteosalvinimi;" LETTERA A ""#DIEWELT"" LEGGI LA LETTERA https://www.facebook.com/252306033154/posts/10157581062978155/?d=n";2020-04-09 17:51:09+00:00;351;984;;#DIEWELT;
32;https://twitter.com/matteosalvinimi/status/1248283348537159682;matteosalvinimi;Ho voluto dirlo con chiarezza al #Senato: l'articolo del giornale tedesco FA SCHIFO. Chiunque ci accosti alla mafia e ai mendicanti si sciacqui la bocca, il nostro popolo ha molto da insegnare e poco da imparare.;2020-04-09 16:15:16+00:00;292;1301;;#Senato;
33;https://twitter.com/matteosalvinimi/status/1248262248897880065;matteosalvinimi;Vergogna!!! Il governo parla di “medici eroi” ma poi blocca il denaro per loro!;2020-04-09 14:51:26+00:00;246;826;;;
34;https://twitter.com/matteosalvinimi/status/1248244657508642816;matteosalvinimi;Quelle splendide notizie che ci danno speranza e coraggio! Buona vita Mattia.;2020-04-09 13:41:32+00:00;63;427;;;
35;https://twitter.com/matteosalvinimi/status/1248224143180521472;matteosalvinimi;"Spero che gli ""europeisti"" abbiano capito: se l'Europa è fame, morte e sacrificio, non è il futuro che meritano i nostri figli. Riprendiamo in mano il nostro Paese, senza andare con il cappello in mano da nessuno. Viva l'Italia e viva gli italiani! (4/4)";2020-04-09 12:20:01+00:00;144;682;;;
36;https://twitter.com/matteosalvinimi/status/1248224141729243143;matteosalvinimi;Se firmeranno anche mezzo #Mes, noi porteremo la sfiducia in quest'aula al governo, che se ne sta fregando di quello che il Parlamento e i cittadini chiedono. (3/4);2020-04-09 12:20:00+00:00;122;620;;#Mes;
37;https://twitter.com/matteosalvinimi/status/1248224140189995009;matteosalvinimi;"Le dichiarazioni del giornale ""Die Welt"" fanno schifo, aspettiamo le scuse, a Berlino e a Bruxelles dovrebbero sciacquarsi la bocca quando parlano di Italia. (2/4)";2020-04-09 12:20:00+00:00;52;189;;;
38;https://twitter.com/matteosalvinimi/status/1248224137035878400;matteosalvinimi;Nel mio intervento di oggi al #Senato credo di essere stato CHIARO. Siamo stufi di avere il permesso dell'Europa per salvare la vita e il lavoro degli italiani! (1/4);2020-04-09 12:19:59+00:00;222;1026;;#Senato;
39;https://twitter.com/matteosalvinimi/status/1248216020055179264;matteosalvinimi;Il mio intervento di poco fa in #Senato.;2020-04-09 11:47:44+00:00;585;1675;;#Senato;
40;https://twitter.com/matteosalvinimi/status/1248215965361471489;matteosalvinimi;#Salvini: Riprendiamo in mano il nostro Paese senza andare col cappello in mano da nessuno. #Senato;2020-04-09 11:47:31+00:00;252;1219;;#Salvini #Senato;
41;https://twitter.com/matteosalvinimi/status/1248215875171356677;matteosalvinimi;#Salvini: I posti letto in Europa dal 2000 sono scesi da 5,7 a 5 per abitante, per tenere fede ai vincoli di spesa. Spero che gli europeisti abbiano capito che se UE è fame, morte e sacrificio non è il Futuro da lasciare ai nostri figli. #Senato;2020-04-09 11:47:10+00:00;121;545;;#Salvini #Senato;
42;https://twitter.com/matteosalvinimi/status/1248215272470831106;matteosalvinimi;#Salvini:Parlamento olandese ha votato 2 volte per dire al governo cosa fare nelle trattative con Bruxelles. Noi non abbiamo dato nessun mandato a Conte e Gualtieri per trattare in Europa, se firmeranno anche solo mezzo MES chiederemo la sfiducia in quest'Aula al Governo.#Senato;2020-04-09 11:44:46+00:00;304;1078;;#Salvini #Senato;
43;https://twitter.com/matteosalvinimi/status/1248214194945699841;matteosalvinimi;#Salvini: Sono stufo di chiedere il permesso dell'Europa per salvare la vita, il negozio, la casa dei cittadini italiani. #Senato;2020-04-09 11:40:29+00:00;275;1376;;#Salvini #Senato;
44;https://twitter.com/matteosalvinimi/status/1248214023973277696;matteosalvinimi;#Salvini: Ci sono 100 pagine di Decreto sulla liquidità. 37mila parole. In Svizzera basta un foglio, un firma, e ti accreditano fino a 500mila franchi sul conto. Senza burocrazia, Corte dei conti, sindacati... #Senato;2020-04-09 11:39:48+00:00;360;1606;;#Salvini #Senato;
45;https://twitter.com/matteosalvinimi/status/1248213941383245824;matteosalvinimi;#Salvini: Non voteremo questo Decreto perché è una presa in giro nei confronti di milioni di italiani che alla fine non vedranno una lira. #Senato;2020-04-09 11:39:28+00:00;120;630;;#Salvini #Senato;
46;https://twitter.com/matteosalvinimi/status/1248213244411510785;matteosalvinimi;#Salvini: Dichiarazione #DieWelt SCHIFOSE. Si sciacquassero la bocca. Aspettiamo le scuse. #Senato;2020-04-09 11:36:42+00:00;117;637;;#Salvini #DieWelt #Senato;
47;https://twitter.com/matteosalvinimi/status/1248213060508094469;matteosalvinimi;#Salvini: Ci sono imprenditori illuminati che stanno integrando cassa integrazione ai propri dipendenti, lo Stato chiederà le tasse tra la quota di cassa integrazione e stipendio pieno. Pensate la burocrazia. Detassate almeno quello. #Senato;2020-04-09 11:35:58+00:00;71;407;;#Salvini #Senato;
48;https://twitter.com/matteosalvinimi/status/1248212704990560258;matteosalvinimi;"#Salvini: Il collega del PD ha parlato di ""Sindaci eroi"" e ""Medici eroi"". Per loro NESSUN AIUTO. Noi come Lega abbiamo proposto di detassare medici. Proposta bocciata. #Senato";2020-04-09 11:34:34+00:00;100;503;;#Salvini #Senato;
49;https://twitter.com/matteosalvinimi/status/1248212569950687234;matteosalvinimi;In diretta dal #Senato per portare la vostra voce. #NoMes LIVE https://www.facebook.com/salviniofficial/videos/535312547411964/?vh=e&ampd=n;2020-04-09 11:34:02+00:00;83;338;;#Senato #NoMes;
50;https://twitter.com/matteosalvinimi/status/1248212312768630784;matteosalvinimi;#Salvini: In questi giorni abbiamo lavorato in commissione proponendo tante cose, col rammarico di non averne vista approvata neanche una. #Senato;2020-04-09 11:33:00+00:00;172;814;;#Salvini #Senato;
51;https://twitter.com/matteosalvinimi/status/1248209522944020481;matteosalvinimi;vi siete arricchiti grazie a una moneta e a un’Unione utili solo alla Germania e adesso ci volete “controllare” e dare lezioni??? Meglio soli, liberi e forti come eravamo e come potremo tornare ad essere, che umiliati, controllati, impoveriti e male accompagnati. (2/2);2020-04-09 11:21:55+00:00;215;788;;;
52;https://twitter.com/matteosalvinimi/status/1248209520251322369;matteosalvinimi;“Gli Italiani devono essere controllati” dalla Commissione Europea... “La mafia aspetta soltanto una nuova pioggia di soldi da Bruxelles...” Così oggi il giornale tedesco Die Welt. Vergognatevi. Vergognatevi e sciacquatevi la bocca quando parlate di Italia: (1/2);2020-04-09 11:21:54+00:00;280;891;;;
53;https://twitter.com/matteosalvinimi/status/1248202789702025216;matteosalvinimi;"""Italiani (mafiosi) da tenere sotto controllo con la Commissione europea"". VERGOGNATEVI, a Berlino e a Bruxelles sciacquatevi la bocca prima di parlare di ITALIA e chiedete scusa!";2020-04-09 10:55:10+00:00;1036;3600;;;
54;https://twitter.com/matteosalvinimi/status/1248191012243214336;matteosalvinimi;Un saluto dall'aula del #Senato, Amici. Seduta sospesa su richiesta del governo. Io interverrò intorno alle 13, cercando di portare la vostra voce.;2020-04-09 10:08:22+00:00;176;936;;#Senato;
55;https://twitter.com/matteosalvinimi/status/1248179921605754881;matteosalvinimi;In diretta dal Senato l’intervento di @AlbertoBagnai. LIVE https://www.facebook.com/252306033154/posts/10157579789223155/;2020-04-09 09:24:18+00:00;225;703;@AlbertoBagnai;;
56;https://twitter.com/matteosalvinimi/status/1248146706111303680;matteosalvinimi;Buongiorno Amici. Vicino ai lampedusani, giustamente molto preoccupati. Mai come in questo periodo di grande difficoltà per l'Italia, i porti dovrebbero rimanere CHIUSI, ma per davvero.;2020-04-09 07:12:18+00:00;599;2107;;;
57;https://twitter.com/matteosalvinimi/status/1247993802691837959;matteosalvinimi;Arrivati oggi 19 medici e infermieri dalla Norvegia Aiuteranno gli operatori sanitari all'Ospedale di Seriate (Bergamo). Grazie ;2020-04-08 21:04:43+00:00;372;2082;;;
58;https://twitter.com/matteosalvinimi/status/1247982558291386372;matteosalvinimi;Da un'eccellenza come il Policlinico San Matteo di Pavia una notizia di speranza per tutta Italia: a breve, grazie ad un esame del sangue, un test affidabile per arrivare a sapere chi è immune al virus e chi no.;2020-04-08 20:20:02+00:00;173;836;;;
59;https://twitter.com/matteosalvinimi/status/1247975881588518914;matteosalvinimi;L'intervento di Massimiliano Romeo, presidente dei senatori della Lega, oggi in aula. LIVE https://www.facebook.com/legasalvinipremier/videos/546994619533889/;2020-04-08 19:53:31+00:00;83;406;;;
60;https://twitter.com/matteosalvinimi/status/1247968396895027202;matteosalvinimi;Un grazie in questo periodo va anche alle tantissime radio e tv locali che con news direttamente dal campo, campagne e informazioni di emergenza sono ogni giorno al fianco delle proprie comunità nella lotta al virus. (2/2);2020-04-08 19:23:46+00:00;51;360;;;
61;https://twitter.com/matteosalvinimi/status/1247968394349023232;matteosalvinimi;Il mio intervento di oggi a @espansionetv, emittente di Como. (1/2) LIVE https://www.facebook.com/salviniofficial/videos/223624468857013/?vh=e&ampd=n;2020-04-08 19:23:46+00:00;55;381;@espansionetv;;
62;https://twitter.com/matteosalvinimi/status/1247957400335908865;matteosalvinimi;Spero che in futuro ci sia un maggiore ascolto della voce di professionisti e imprese. (3/3);2020-04-08 18:40:04+00:00;69;500;;;
63;https://twitter.com/matteosalvinimi/status/1247957398297460737;matteosalvinimi;Per milioni di Italiani purtroppo la cassa integrazione non arriverà il 15 aprile come promesso ma parecchio più tardi, a causa di diversi problemi da noi già da tempo segnalati, fra cui la disorganizzazione dell’INPS. (2/3);2020-04-08 18:40:04+00:00;105;589;;;
64;https://twitter.com/matteosalvinimi/status/1247957396342870019;matteosalvinimi;Pomeriggio al telefono con consulenti del lavoro, commercialisti, bancari e imprenditori. (1/3);2020-04-08 18:40:03+00:00;118;843;;;
65;https://twitter.com/matteosalvinimi/status/1247942887402344452;matteosalvinimi;Il mio e nostro sostegno al Sindaco di Messina e alle sue battaglie in difesa dei suoi cittadini. Sindaci, governatori, medici e sanitari vanno appoggiati e incoraggiati, non insultati o denunciati. VIDEO COMPLETO https://www.facebook.com/252306033154/posts/10157577027703155/;2020-04-08 17:42:24+00:00;437;1568;;;
66;https://twitter.com/matteosalvinimi/status/1247921520858599425;matteosalvinimi;troppo spesso dimenticati e addirittura lasciati senza mascherine e altri dispositivi di protezione. Bonafede ha il DOVERE di preoccuparsi della Polizia Penitenziaria. Chi difende gli Italiani non va abbandonato, mai. (2/2);2020-04-08 16:17:30+00:00;82;499;;;
67;https://twitter.com/matteosalvinimi/status/1247921518392365059;matteosalvinimi;Mentre il governo e la maggioranza spalancano i cancelli delle galere per migliaia di rapinatori, ladri, truffatori e spacciatori, dentro le mura del carcere restano le donne e gli uomini in divisa, (1/2);2020-04-08 16:17:29+00:00;185;763;;;
68;https://twitter.com/matteosalvinimi/status/1247906443464003586;matteosalvinimi;"Se riescono a trovare 15 miliardi per l'Africa e all'Italia riescono solo a dire: ""O ti becchi il Mes e ti infili in una gabbia, oppure per voi non c'è niente"", allora capisco quei sindaci che hanno ammainato la bandiera dell'Europa. LIVE https://www.facebook.com/salviniofficial/videos/517262829176227/?vh=e&ampd=n";2020-04-08 15:17:35+00:00;242;969;;;
69;https://twitter.com/matteosalvinimi/status/1247882172217692171;matteosalvinimi;Siete anche voi fra questi? Segnalateci le vostre esperienza, per poter portare la vostra voce nelle iniziative parlamentari della Lega e nel nostro confronto con il governo. (3/3);2020-04-08 13:41:09+00:00;106;582;;;
70;https://twitter.com/matteosalvinimi/status/1247882170166730754;matteosalvinimi;che non hanno avuto contributi o aiuti, che hanno le rate del mutuo all'incasso, che dalla Banca si sono sentiti rispondere picche, che stanno pagando affitti, bollette e stipendi. (2/3);2020-04-08 13:41:08+00:00;122;630;;;
71;https://twitter.com/matteosalvinimi/status/1247882167687892996;matteosalvinimi;Ho la casella mail, Messenger, Whatsapp e il telefonino pieno di messaggi di Italiani (commercianti, imprenditori, Partite Iva, liberi professionisti, famiglie e lavoratori in genere) che nonostante decreti e promesse non hanno ancora ricevuto un euro di rimborso, (1/3);2020-04-08 13:41:07+00:00;413;1789;;;
72;https://twitter.com/matteosalvinimi/status/1247869717643231233;matteosalvinimi; LIVE https://www.facebook.com/salviniofficial/videos/2535460586706589/?vh=e&ampd=n (3/3);2020-04-08 12:51:39+00:00;49;230;;;
73;https://twitter.com/matteosalvinimi/status/1247869716078768128;matteosalvinimi;L’Italia ha dato e continua a dare ogni anno miliardi di euro all’Unione Europea, merita tutto il sostegno necessario, ma non attraverso meccanismi perversi che ipotecherebbero il futuro del Paese. Su questo la Lega si opporrà in ogni sede e con ogni mezzo. (2/3);2020-04-08 12:51:39+00:00;97;510;;;
74;https://twitter.com/matteosalvinimi/status/1247869713146929162;matteosalvinimi;"Altro fallimento in Europa, altri giorni persi. È ancora attuale quanto detto ieri sera da Floris. È il momento di farsi sentire, senza se e senza ma: NO al MES, SÌ a strumenti come i buoni del Tesoro ""Orgoglio Italiano"", che anche il professor Tremonti stamane rilancia. (1/3)";2020-04-08 12:51:38+00:00;149;773;;;
75;https://twitter.com/matteosalvinimi/status/1247852890275876864;matteosalvinimi;"”Il Governo prenda esempio dai suoi amministratori e dimostri che in Italia le regole valgono per tutti"". (3/3)";2020-04-08 11:44:47+00:00;100;573;;;
76;https://twitter.com/matteosalvinimi/status/1247852887377506305;matteosalvinimi;".@eugenio_zoffili (Lega): ""Da Presidente del Comitato Bicamerale di vigilanza sull'immigrazione sto convocando in questi minuti l'Ufficio di Presidenza per programmare le iniziative necessarie a supporto del Sindaco Martello e dei lampedusani”. (2/3)";2020-04-08 11:44:46+00:00;99;563;@eugenio_zoffili;;
77;https://twitter.com/matteosalvinimi/status/1247852884823334913;matteosalvinimi;Mentre gli italiani sono in quarantena, altri sbarchi a Lampedusa, isolani giustamente molto preoccupati. (1/3);2020-04-08 11:44:46+00:00;384;1377;;;
78;https://twitter.com/matteosalvinimi/status/1247835783274409984;matteosalvinimi;Non so che cosa ne pensiate voi, a me pare un'assurdità.;2020-04-08 10:36:49+00:00;320;1475;;;
