id;permalink;username;text;date;retweet;favorite;mentions;hashtag;geo
1469;https://twitter.com/matteosalvinimi/status/1230258988694081539;matteosalvinimi;Roba da matti. Ma come si fa a voler sfrattare una signora di 94 anni??? Solidarietà alla signora Luigia! LIVE https://www.facebook.com/salviniofficial/videos/2255089394794937/;2020-02-19 22:32:54+00:00;189;878;;;
1470;https://twitter.com/matteosalvinimi/status/1230248433535066112;matteosalvinimi;Ieri sera a Napoli con Emanuela e questo bellissimo ritratto con Mirta. Grazie ;2020-02-19 21:50:58+00:00;121;1033;;;
1471;https://twitter.com/matteosalvinimi/status/1230240713318727680;matteosalvinimi;Priorità del nuovo governo della Campania che vogliamo è ripartire da qui, con l’obiettivo di inserire tutti i ragazzi speciali in un contesto normale. P.s. Sosteniamoli! Potete comprate qualcosa nel loro negozio online: https://www.giffas.it/robe-da-matti/ LIVE ;2020-02-19 21:20:17+00:00;72;463;;;
1472;https://twitter.com/matteosalvinimi/status/1230240709887787010;matteosalvinimi;Onore alle mamme e ai papà incontrati oggi a Napoli: fanno l'avvocato, il medico, il commerciante ma dedicano tanta parte della loro giornata ai 650 ragazzi del centro Giffas. Li ringrazio di cuore per avermi aperto le loro porte e mi porto dei compiti a casa.;2020-02-19 21:20:16+00:00;143;930;;;
1473;https://twitter.com/matteosalvinimi/status/1230236109457805318;matteosalvinimi;Amici, domattina ultimo appuntamento in Puglia alle 9.30, a Saclì (Lecce) e poi si sale fino alle Marche, passando per l'Abruzzo! Vi aspetto alle 14 a Chieti e dalle 18 in poi a Pesaro. Chi si ferma è perduto! ;2020-02-19 21:01:59+00:00;82;424;;;
1474;https://twitter.com/matteosalvinimi/status/1230223491548504066;matteosalvinimi;Io e milioni di italiani siamo stufi di un governo che litiga su tutto e blocca il Paese, sarebbe ora che Conte si facesse da parte.;2020-02-19 20:11:51+00:00;522;3009;;;
1475;https://twitter.com/matteosalvinimi/status/1230219518527647745;matteosalvinimi;Siamo in tantissimi qui a Squinzano (Lecce), spettacolo! Seguiteci LIVE https://www.facebook.com/salviniofficial/videos/176754310409016/?vh=e&ampd=n;2020-02-19 19:56:04+00:00;79;480;;;
1476;https://twitter.com/matteosalvinimi/status/1230208635571232768;matteosalvinimi;Pazzesco. Galera e buttare via la chiave per gli schifosi sfruttatori. Punto. http://www.rainews.it/dl/rainews/articoli/allarme-Roma-bimbi-si-prostituiscono-anche-a-10-anni-366b8e8e-fee0-4dfc-bb6c-c452f809da74.html;2020-02-19 19:12:49+00:00;281;1234;;;
1477;https://twitter.com/matteosalvinimi/status/1230196574179020800;matteosalvinimi;Vi salutiamo e vi abbracciamo da Taranto, ci siete? LIVE https://www.facebook.com/salviniofficial/videos/2822318514521316/;2020-02-19 18:24:53+00:00;82;510;;;
1478;https://twitter.com/matteosalvinimi/status/1230188892961300483;matteosalvinimi;"Pare che mi stia arrivando un altro processo, questa volta per ""abuso di ufficio"". Sono tranquillo, io non mollo.";2020-02-19 17:54:22+00:00;542;3060;;;
1479;https://twitter.com/matteosalvinimi/status/1230178560670863361;matteosalvinimi;Qui Comando Provinciale di Taranto, insieme a donne e uomini dell'Arma dei Carabinieri. Onore a chi si impegna ogni giorno per tutelare l'ordine e la sicurezza dei cittadini ;2020-02-19 17:13:19+00:00;148;690;;;
1480;https://twitter.com/matteosalvinimi/status/1230176667676631040;matteosalvinimi;Viva l’Italia del Buonsenso! Iscriviti alla Lega: http://legaonline.it/iscriviti;2020-02-19 17:05:47+00:00;91;512;;;
1481;https://twitter.com/matteosalvinimi/status/1230168171665072128;matteosalvinimi;Fragole lucane di Policoro, vi assicuro che sono qualcosa di eccezionale! Altro che le porcherie che vorrebbero farci mangiare col “Nutriscore” europeo, viva l’eccellenza delle produzioni italiane, le migliori del mondo! ;2020-02-19 16:32:02+00:00;231;1451;;;
1482;https://twitter.com/matteosalvinimi/status/1230157389619507200;matteosalvinimi;La mia intervista di questa mattina su @RadioCRC_Napoli, eccola. LIVE https://www.facebook.com/salviniofficial/videos/2283893738569912/;2020-02-19 15:49:11+00:00;68;355;@RadioCRC_Napoli;;
1483;https://twitter.com/matteosalvinimi/status/1230147143031250945;matteosalvinimi;"I soliti ""democratici"" dei centri sociali, sostenuti da qualche amministratore comunale, pensano di essere i padroni di Napoli? Ma chi si credono di essere? Al loro odio abbiamo risposto e risponderemo sempre con il sorriso e la forza delle nostre idee.";2020-02-19 15:08:28+00:00;300;1506;;;
1484;https://twitter.com/matteosalvinimi/status/1230136699453345792;matteosalvinimi;Ennesimo episodio, quanta tristezza. Sempre più urgente la legge sulle telecamere obbligatorie, bloccata da Pd e 5 Stelle in nome di non si sa cosa. Le persone perbene non hanno nulla da temere, i bimbi picchiati o gli anziani maltrattati sì.;2020-02-19 14:26:58+00:00;474;1846;;;
1485;https://twitter.com/matteosalvinimi/status/1230119548222918657;matteosalvinimi;In diretta da Potenza con il sindaco Guarente e tanti amministratori della Lega! LIVE https://www.facebook.com/salviniofficial/videos/195615805138717/;2020-02-19 13:18:49+00:00;63;406;;;
1486;https://twitter.com/matteosalvinimi/status/1230107824769859585;matteosalvinimi;Ennesimo schiaffo per il ministero dell’Interno: dopo aver ospitato le Ong e spalancato i porti, ora diventa a tutti gli effetti il ministero dell’Invasione. Pur di tenersi le poltrone, i 5 Stelle rinnegano quanto avevano approvato pochi mesi fa. Roba da matti.;2020-02-19 12:32:14+00:00;185;854;;;
1487;https://twitter.com/matteosalvinimi/status/1230107821943001088;matteosalvinimi; UMILIATO il Viminale: il governo vuole cambiare i Decreti sicurezza e affidare a Palazzo Chigi la responsabilità delle scelte sull’immigrazione.;2020-02-19 12:32:13+00:00;225;936;;;
1488;https://twitter.com/matteosalvinimi/status/1230095829169508353;matteosalvinimi;Voglio un’Italia dove nessuno sia dimenticato, dove ogni disabile, ogni RAGAZZO SPECIALE insieme alla sua famiglia abbia tutti i diritti e le opportunità che gli spettano. LIVE https://www.facebook.com/salviniofficial/videos/205264154003421/;2020-02-19 11:44:34+00:00;161;827;;;
1489;https://twitter.com/matteosalvinimi/status/1230079320250433536;matteosalvinimi;Se ti fai le foto con Benetton e Toscani, questi sono i risultati... VIDEO COMPLETO https://www.facebook.com/252306033154/posts/10157406614398155/;2020-02-19 10:38:58+00:00;737;2789;;;
1490;https://twitter.com/matteosalvinimi/status/1230061827599589376;matteosalvinimi;Posso offrirvi una sfogliata riccia napoletana? Delizia per gli occhi e per il palato!;2020-02-19 09:29:27+00:00;226;2040;;;
1491;https://twitter.com/matteosalvinimi/status/1230055178948222976;matteosalvinimi;Qui Napoli, che meraviglia. Auguro una splendida giornata di lavoro, di studio, di amore, di passione e di Italia a tutti voi ;2020-02-19 09:03:02+00:00;179;1417;;;
1492;https://twitter.com/matteosalvinimi/status/1230045809892372481;matteosalvinimi;"Le due Napoli di ieri: quella di chi si sente ""democratico"" ma va in piazza solo per odiare, insultare, aggredire le Forze dell'Ordine e quella che si stringe nell'abbraccio del sorriso, della speranza, delle idee, del Futuro ";2020-02-19 08:25:48+00:00;128;713;;;
1493;https://twitter.com/matteosalvinimi/status/1230035404881104902;matteosalvinimi;Ora in collegamento su @RadioCRC_Napoli! Se vi va potete seguirmi anche in streaming https://www.radiocrc.com;2020-02-19 07:44:28+00:00;46;329;@RadioCRC_Napoli;;
1494;https://twitter.com/matteosalvinimi/status/1230024679668289538;matteosalvinimi;Buongiorno, grazie ai tantissimi ragazzi che si sono avvicinati alla Lega con la voglia di riprendere in mano il proprio futuro! ;2020-02-19 07:01:51+00:00;170;1053;;;
1495;https://twitter.com/matteosalvinimi/status/1229908680520478722;matteosalvinimi;Ancora una foto: non posso non condividere con voi questo incantevole panorama di Napoli, quanta gente splendida ho incontrato oggi Buonanotte!;2020-02-18 23:20:54+00:00;130;977;;;
1496;https://twitter.com/matteosalvinimi/status/1229906404577890307;matteosalvinimi;Grande Gianluca, addestramento eccellente! E grazie a chi, come Gianni Maddaloni nella sua palestra di Scampia, con lo sport regala passione e Futuro. Questa è l'Italia più bella. Buonanotte <3;2020-02-18 23:11:52+00:00;193;1153;;;
1497;https://twitter.com/matteosalvinimi/status/1229894208800141313;matteosalvinimi;Mentre pochi facinorosi e incivili questa sera hanno insultato e aggredito la Polizia guidati solo da odio, povertà di idee e di spirito, questa era la Napoli con la Lega, un teatro stracolmo e pieno di entusiasmo, una Comunità che osa, sogna, ama Grazie davvero, di cuore.;2020-02-18 22:23:24+00:00;210;1211;;;
1498;https://twitter.com/matteosalvinimi/status/1229873338593443843;matteosalvinimi;Domani riparto da Napoli e poi Basilicata e la Puglia! Verso l'ora di pranzo sarò a Potenza, dalle 17.30 a Taranto, e alle 20.30 a Squinzano (Lecce). Vi aspetto in tantissimi. Passaparola!;2020-02-18 21:00:28+00:00;96;515;;;
1499;https://twitter.com/matteosalvinimi/status/1229862568505815042;matteosalvinimi;Vi ripropongo il mio intervento di poco fa al Teatro Augusteo di Napoli (stracolmo!!!). State con noi! LIVE https://www.facebook.com/salviniofficial/videos/200496574659029/;2020-02-18 20:17:40+00:00;124;582;;;
1500;https://twitter.com/matteosalvinimi/status/1229856196078817281;matteosalvinimi;"Grazie Napoli, questo calore e questa accoglienza sono la migliore risposta ai cosiddetti ""democratici"" che sanno solo odiare. Tra poco seguite l'intervento sulla mia pagina Facebook!";2020-02-18 19:52:21+00:00;377;2056;;;
1501;https://twitter.com/matteosalvinimi/status/1229838155978887168;matteosalvinimi;Teatro Augusteo, Napoli. Guardate che spettacolo, grazie! Più tardi potrete seguire sulla mia pagina Facebook il video della serata ;2020-02-18 18:40:40+00:00;124;719;;;
1502;https://twitter.com/matteosalvinimi/status/1229828916673687553;matteosalvinimi;Grazie al Maestro Gianni Maddaloni che ho incontrato oggi nella sua palestra a Scampia, grazie per quello che fa per il suo quartiere e la sua città togliendo tanti ragazzi dalla strada e indirizzandoli allo sport.;2020-02-18 18:03:57+00:00;98;615;;;
1503;https://twitter.com/matteosalvinimi/status/1229821824344772609;matteosalvinimi;"Oggi a Napoli alla storica sartoria ""Marinella"", orgoglio della città e dell'Italia, dove ho incontrato numerosi imprenditori, che nonostante tutto resistono, producono e investono: vanno aiutati e sostenuti in ogni modo, la loro missione è fondamentale per tutto il Paese.";2020-02-18 17:35:46+00:00;159;866;;;
1504;https://twitter.com/matteosalvinimi/status/1229802962198974465;matteosalvinimi;Mi sembra una situazione vergognosa. Raggi e Zingaretti, PD e 5 Stelle: datevi una mossa, sottoporre chi già soffre a questo trattamento non è degno di un Paese civile.;2020-02-18 16:20:49+00:00;734;2492;;;
1505;https://twitter.com/matteosalvinimi/status/1229792164630220801;matteosalvinimi;Altro che privacy, quando è in gioco l'incolumità dei nostri figli, dei nostri nonni, di chi è fragile e indifeso non si scherza. Sveglia! #telecameresubito;2020-02-18 15:37:55+00:00;290;1220;;#telecameresubito;
1506;https://twitter.com/matteosalvinimi/status/1229759386698092547;matteosalvinimi;Ma vi pare una situazione normale? Vi pare sensato riaprire i porti? Vi sembra razionale CANCELLARE i Decreti sicurezza? Solo a me sembra una follia?;2020-02-18 13:27:40+00:00;273;1496;;;
1507;https://twitter.com/matteosalvinimi/status/1229759355349762048;matteosalvinimi; Dal Centro immigrati di Bari i medici lanciano l'allarme: scappano anche gli immigrati malati di tubercolosi e HIV, vanificando ogni sforzo di controllo sanitario, con rischi gravi per loro e per tutte le persone con cui vengono in contatto, in Italia e in Europa.;2020-02-18 13:27:32+00:00;966;2362;;;
1508;https://twitter.com/matteosalvinimi/status/1229756572504612864;matteosalvinimi;Finalmente! Siamo pronti ad offrire un sano e onesto cambiamento anche ai cittadini della Valle D’Aosta. Forza Nicoletta, forza Lega.;2020-02-18 13:16:29+00:00;132;719;;;
1509;https://twitter.com/matteosalvinimi/status/1229741319930761216;matteosalvinimi;Penso di essere stato chiaro ieri sera su Rete 4. Vi ripropongo la mia intervista, buon pranzo Amici! LIVE https://www.facebook.com/salviniofficial/videos/229799461532469/;2020-02-18 12:15:52+00:00;98;529;;;
1510;https://twitter.com/matteosalvinimi/status/1229723321425592320;matteosalvinimi;Ma è tutto BLOCCATO! Siamo qui a Roma davanti al Ministero del Lavoro per capire perché: la tutela dei bimbi, dei nonni e delle persone più fragili NON può più aspettare! Seguite in diretta.;2020-02-18 11:04:21+00:00;97;524;;;
1511;https://twitter.com/matteosalvinimi/status/1229723318435143680;matteosalvinimi;Gli italiani aspettano la legge, fortemente voluta dalla Lega, sulle telecamere in asili, case di riposo, strutture per disabili. LIVE https://www.facebook.com/salviniofficial/videos/572908123566676/;2020-02-18 11:04:20+00:00;146;711;;;
1512;https://twitter.com/matteosalvinimi/status/1229717877697150978;matteosalvinimi;Caffè di metà mattina in ufficio ;2020-02-18 10:42:43+00:00;88;796;;;
1513;https://twitter.com/matteosalvinimi/status/1229708496746184704;matteosalvinimi;Un grazie alle Forze dell'ordine che stanno eseguendo le indagini e un grande abbraccio al signor Giuseppe.;2020-02-18 10:05:27+00:00;84;685;;;
1514;https://twitter.com/matteosalvinimi/status/1229708462961184769;matteosalvinimi;Lignano Sabbiadoro (Udine). Riempito di pugni e derubato nel cuore della notte. SCHIFOSI. E per il governo dei poltronari di sinistra la priorità è cancellare i miei Decreti sicurezza...;2020-02-18 10:05:19+00:00;398;1503;;;
1515;https://twitter.com/matteosalvinimi/status/1229688195132121088;matteosalvinimi;Il Fatto, per insultarmi, oggi parla di “Coglionevirus”. Neanche di fronte ad un’epidemia da migliaia di morti si fermano sti rancorosi... Bacioni e sorrisi per chi ci vuole male ;2020-02-18 08:44:46+00:00;341;1974;;;
1516;https://twitter.com/matteosalvinimi/status/1229666725462970368;matteosalvinimi;Buongiorno Amici, buon martedì a tutti voi. Chi ama l'Italia non molla mai, e io sono testardo! ;2020-02-18 07:19:28+00:00;167;1149;;;
1517;https://twitter.com/matteosalvinimi/status/1229536867131043840;matteosalvinimi;Oggi è la #festadelgatto, fate una carezza a tutti i vostri bambini felini lì con voi: i gattini hanno una marcia in più! Buonanotte Amici #gattiniconSalvini;2020-02-17 22:43:27+00:00;108;720;;#festadelgatto #gattiniconSalvini;
1518;https://twitter.com/matteosalvinimi/status/1229524630119108608;matteosalvinimi;Orgoglioso della mia coerenza e della mia dignità: dopo 6 mesi la Lega è ancora saldamente il primo partito italiano e il centrodestra viaggia intorno al 50%, i conti prima o poi gli italiani glieli faranno fare, e noi siamo pronti.;2020-02-17 21:54:49+00:00;103;830;;;
1519;https://twitter.com/matteosalvinimi/status/1229524627917090818;matteosalvinimi;Avete seguito questa sera su Rete 4? Questo governo non ha fatto NIENTE, non ha un'anima, non ha un progetto, non trova l'accordo su nulla, se non sul fatto di mandare a processo il sottoscritto come sequestratore di persona e di evitare le elezioni. #StaseraItalia @StaseraItalia;2020-02-17 21:54:49+00:00;149;1038;@StaseraItalia;#StaseraItalia;
1520;https://twitter.com/matteosalvinimi/status/1229513923491176451;matteosalvinimi;E il governo su cosa discute? CANCELLARE i Decreti sicurezza. Ma non vi sembra una follia? Serve PIÙ SICUREZZA, e TOLLERANZA ZERO!;2020-02-17 21:12:17+00:00;223;1239;;;
1521;https://twitter.com/matteosalvinimi/status/1229513879656583169;matteosalvinimi;A Castiglione delle Stiviere (Mantova) un nigeriano di 29 anni armato di ACCETTA minaccia gli automobilisti, ferisce un passante, sfascia auto e vetrine. Arrestato per strage, tentato omicidio, porto abusivo d'arma, lesioni e danneggiamento.;2020-02-17 21:12:06+00:00;715;2286;;;
1522;https://twitter.com/matteosalvinimi/status/1229498003519606784;matteosalvinimi;#Salvini: in Italia si entra se si ha il permesso di entrare. #StaseraItalia;2020-02-17 20:09:01+00:00;166;1039;;#Salvini #StaseraItalia;
1523;https://twitter.com/matteosalvinimi/status/1229497474357714944;matteosalvinimi;#Salvini: Io e Renzi siamo come il giorno e la notte. Abbiamo una concezione della vita, del mondo e della politica completamente opposta. #staseraitalia;2020-02-17 20:06:55+00:00;90;643;;#Salvini #staseraitalia;
1524;https://twitter.com/matteosalvinimi/status/1229495259941539840;matteosalvinimi;#Salvini: per me la dignità e la parola data valgono più di ogni ministero. Noi non potevamo andare avanti con Toninelli... Questi invece governano con chiunque pur di mantenere la poltrona. #staseraitalia;2020-02-17 19:58:07+00:00;174;1216;;#Salvini #staseraitalia;
1525;https://twitter.com/matteosalvinimi/status/1229493229550260225;matteosalvinimi;"#Salvini: Se tu mi dici che per andare a palazzo Chigi devo dire ""Viva Macron, viva la Merkel""... Io non lo dirò. #staseraitalia";2020-02-17 19:50:03+00:00;144;813;;#Salvini #staseraitalia;
1526;https://twitter.com/matteosalvinimi/status/1229493222256320512;matteosalvinimi;#Salvini: In Italia ci sono seri problemi di disoccupazione, l'emergenza è il Lavoro. Ma come fanno a pensare di cancellare #Quota100? Ma sono matti? #staseraitalia;2020-02-17 19:50:01+00:00;98;646;;#Salvini #Quota100 #staseraitalia;
1527;https://twitter.com/matteosalvinimi/status/1229492792809971712;matteosalvinimi;#Salvini: Chi dice di voler cancellare i #decretisicurezza dimezza la potenza di fuoco dell'agenzia antimafia. #staseraitalia;2020-02-17 19:48:19+00:00;65;436;;#Salvini #decretisicurezza #staseraitalia;
1528;https://twitter.com/matteosalvinimi/status/1229492613058830336;matteosalvinimi;#Salvini: Cancellare #decretisicurezza significa aiutare la mafia e gli spacciatori di droga. Ovviamente non si parla solo d'immigrazione, evidentemente chi vuole modificarli... non li ha letti bene. #staseraitalia;2020-02-17 19:47:36+00:00;90;537;;#Salvini #decretisicurezza #staseraitalia;
1529;https://twitter.com/matteosalvinimi/status/1229492158912135168;matteosalvinimi;#Salvini: Io non riuscirei mai a governare con la Lega al lunedì, e col Pd al martedì. Conte con la sua faccia di bronzo ci è riuscito. Gli lascio la Presidenza ancora per qualche mese, forse, ma cosa sta facendo per l'Italia? NIENTE. #staseraitalia;2020-02-17 19:45:48+00:00;116;626;;#Salvini #staseraitalia;
1530;https://twitter.com/matteosalvinimi/status/1229491139092340737;matteosalvinimi;#Salvini: Nei Decreti c'erano soldi per le telecamere nei comuni, più poteri ai sindaci, assunzioni di donne e uomini delle Forze dell'ordine, raddoppio dei fondi per Agenzia per beni confiscati alla mafia, tutele per agenti in servizio nelle piazze violente. #staseraitalia;2020-02-17 19:41:45+00:00;186;869;;#Salvini #staseraitalia;
1531;https://twitter.com/matteosalvinimi/status/1229489707295399936;matteosalvinimi;#Salvini: Gli italiani hanno apprezzato quello che abbiamo fatto al governo altrimenti non saremmo sopra al 30% dopo 6 mesi di opposizione. Ci stiamo preparando. #staseraitalia;2020-02-17 19:36:03+00:00;195;1161;;#Salvini #staseraitalia;
1532;https://twitter.com/matteosalvinimi/status/1229488633595518988;matteosalvinimi;Pronto ad andare in onda su Rete 4, ci siete? #StaseraItalia @StaseraItalia;2020-02-17 19:31:47+00:00;67;478;@StaseraItalia;#StaseraItalia;
1533;https://twitter.com/matteosalvinimi/status/1229484349197836289;matteosalvinimi;Buonasera Amici, verso le 20.30 sarò in diretta su Rete 4! Chi di voi sarà davanti alla tivù? #StaseraItalia @StaseraItalia;2020-02-17 19:14:46+00:00;90;518;@StaseraItalia;#StaseraItalia;
1534;https://twitter.com/matteosalvinimi/status/1229476402552016897;matteosalvinimi;Pazzesco. Tutta la mia solidarietà a questo tassista di Roma.;2020-02-17 18:43:11+00:00;406;2017;;;
1535;https://twitter.com/matteosalvinimi/status/1229467948538040320;matteosalvinimi;Lavoro, salute, ambiente, infrastrutture, tasse, taglio della burocrazia, sanità e ancora tanto altro. La Lega c'è, abbiamo un progetto di Italia e di Futuro alternativo al nulla del governo Renzi, Conte e Zingaretti, nemico degli enti locali e dei produttori.;2020-02-17 18:09:35+00:00;55;397;;;
1536;https://twitter.com/matteosalvinimi/status/1229467946113785856;matteosalvinimi;Una bellissima giornata di lavoro e di confronto qui a Roma: con i nostri 200 amministratori regionali abbiamo portato alla luce quello che la Lega fa dove governa, che trasformeremo in proposte anche a livello parlamentare.;2020-02-17 18:09:35+00:00;86;567;;;
1537;https://twitter.com/matteosalvinimi/status/1229462784389394433;matteosalvinimi;Profondo disprezzo per chi ancora nel 2020 disonora le donne e gli uomini vittime del terrorismo rosso. Grazie, Massimo, per il tuo gesto coraggioso.;2020-02-17 17:49:04+00:00;108;692;;;
1538;https://twitter.com/matteosalvinimi/status/1229462782388711430;matteosalvinimi;“Spero che ti sparino in bocca”. Un abbraccio di solidarietà all’amico Giletti a cui hanno augurato la morte dopo aver cacciato dallo studio l’ex brigatista Etro per aver detto: “Preferisco aver le mani sporche di sangue che di acqua”. VIDEO COMPLETO https://www.facebook.com/252306033154/posts/10157401313688155/;2020-02-17 17:49:04+00:00;302;1231;;;
1539;https://twitter.com/matteosalvinimi/status/1229437353871233025;matteosalvinimi;Disse durante la Messa che un cristiano non può essere della Lega, non ho parole... Se questo prete, che mi odia, chiederà scusa e devolverà 1.000 euro ad una Onlus che si occupa di disabili, pace fatta e amici come prima.;2020-02-17 16:08:01+00:00;224;962;;;
1540;https://twitter.com/matteosalvinimi/status/1229426961757409280;matteosalvinimi;In diretta da Roma dopo alcune ore di studio, confronto, progetto tra i duecento uomini e donne della Lega che amministrano le regioni. L’economia non aspetta i litigi di Conte, Renzi e Zingaretti. Noi siamo pronti. LIVE https://www.facebook.com/salviniofficial/videos/497513607865737/;2020-02-17 15:26:43+00:00;108;538;;;
1541;https://twitter.com/matteosalvinimi/status/1229417848319160320;matteosalvinimi;Come si cambia per la poltrona...;2020-02-17 14:50:31+00:00;288;1111;;;
1542;https://twitter.com/matteosalvinimi/status/1229404612836257792;matteosalvinimi;Felice di tornare domani a Napoli, vi aspetto in tantissimi alle 18.30 al Teatro Augusteo!;2020-02-17 13:57:55+00:00;81;497;;;
1543;https://twitter.com/matteosalvinimi/status/1229388533401518082;matteosalvinimi;Orgoglioso degli oltre 200 tra presidenti, assessori e consiglieri regionali della Lega, da Nord a Sud, oggi al lavoro a Roma per condividere esperienze e buone pratiche, unire forze e competenze, riportare il Buonsenso al governo del Paese #vincelasquadra;2020-02-17 12:54:01+00:00;92;586;;#vincelasquadra;
1544;https://twitter.com/matteosalvinimi/status/1229373475913113601;matteosalvinimi;Per Martina del Pd, il governo ha fatto bene a non presentarsi al Senato per “evitare a Salvini di fare spettacolo”. Ma roba da matti.;2020-02-17 11:54:11+00:00;273;1480;;;
1545;https://twitter.com/matteosalvinimi/status/1229355374404415489;matteosalvinimi;In diretta dal Palazzo delle Esposizioni di Roma dove oggi si riuniscono duecento tra presidenti, assessori e consiglieri regionali della Lega da tutta Italia, riportiamo il Buonsenso al governo del Paese! #primagliitaliani LIVE https://www.facebook.com/salviniofficial/videos/231551937856712/;2020-02-17 10:42:16+00:00;70;420;;#primagliitaliani;
1546;https://twitter.com/matteosalvinimi/status/1229354917443362816;matteosalvinimi;Un caffè e un sorriso per voi da Roma.;2020-02-17 10:40:27+00:00;82;833;;;
1547;https://twitter.com/matteosalvinimi/status/1229344246383153152;matteosalvinimi;Conte e PD all’attacco dei Decreti Sicurezza. Li fermeremo, con il futuro degli Italiani non si scherza. Per fare parte della squadra con la nuova tessera della Lega http://legaonline.it/iscriviti LIVE https://www.facebook.com/salviniofficial/videos/1340612616122659/;2020-02-17 09:58:03+00:00;128;591;;;
1548;https://twitter.com/matteosalvinimi/status/1229327687061311490;matteosalvinimi;Pensano di fare un dispetto a Salvini, fanno solo il male del Paese.;2020-02-17 08:52:15+00:00;137;825;;;
1549;https://twitter.com/matteosalvinimi/status/1229327684901199873;matteosalvinimi;"Pazzesco. Con tutti i problemi che ci sono in Italia qual è la loro priorità? Smantellare i Decreti sicurezza: più protezioni ""umanitarie"", tempi più rapidi per dare la cittadinanza, stop alle multe per le Ong, stop alla confisca delle navi. Alè!";2020-02-17 08:52:14+00:00;452;1711;;;
1550;https://twitter.com/matteosalvinimi/status/1229313274967142400;matteosalvinimi;Male non fare, paura non avere. Buona settimana Amici ;2020-02-17 07:54:58+00:00;324;2491;;;
1551;https://twitter.com/matteosalvinimi/status/1229182944192933899;matteosalvinimi;Orgoglioso della grande famiglia della Lega, una splendida Comunità che accoglie, che cresce e che sorride, alla faccia di chi ci vuole male . Buonanotte Amici, chi si ferma è perduto!;2020-02-16 23:17:05+00:00;241;1877;;;
1552;https://twitter.com/matteosalvinimi/status/1229159554207842311;matteosalvinimi;Ci saranno due Roma: quella dei signor NO di professione, del passato, dei Raggi e degli Zingaretti, e quella che sogna e costruisce la Capitale del Futuro. Noi siamo pronti.;2020-02-16 21:44:09+00:00;86;575;;;
1553;https://twitter.com/matteosalvinimi/status/1229159533089566729;matteosalvinimi;E lasciatemi sottolineare una priorità assoluta: l’attenzione ai disabili, dimenticati da una Regione assente.;2020-02-16 21:44:04+00:00;88;584;;;
