id;permalink;username;text;date;retweet;favorite;mentions;hashtag;geo
722;https://twitter.com/matteosalvinimi/status/1240035488406388736;matteosalvinimi;#Salvini: Come sto vivendo in questi giorni? Sono attaccato al telefono giorno e notte, con sindaci, governatori e tecnici. L'emergenza è quotidiana, non solo in Lombardia. #Fuoridalcoro;2020-03-17 22:01:13+00:00;126;1169;;#Salvini #Fuoridalcoro;
723;https://twitter.com/matteosalvinimi/status/1240035454772264962;matteosalvinimi;Ora in onda su Rete 4, ospite di @mariogiordano5. #fuoridalcoro @fuoridalcorotv LIVE https://www.facebook.com/salviniofficial/videos/217238072953382/;2020-03-17 22:01:05+00:00;57;318;@mariogiordano5 @fuoridalcorotv;#fuoridalcoro;
724;https://twitter.com/matteosalvinimi/status/1240014274120081408;matteosalvinimi;Verrete ricontattati appena possibile grazie a una squadra di tecnici e esperti che potrà dare una mano a voi, come voi potrete darla a noi con segnalazioni da trasformare in iniziative politiche. (4/4);2020-03-17 20:36:55+00:00;73;357;;;
725;https://twitter.com/matteosalvinimi/status/1240014272438177793;matteosalvinimi;potete scrivere un'email a: emergenza@legaonline.it indicando il vostro NOME e RECAPITO TELEFONICO. (3/4);2020-03-17 20:36:55+00:00;69;340;;;
726;https://twitter.com/matteosalvinimi/status/1240014270781362180;matteosalvinimi;Se volete segnalare problemi e proposte sul Decreto del governo (che speriamo arrivi presto nella sua forma finale e ufficiale...), riguardo lavoratori, imprese, famiglie (es. aiuti, scadenze fiscali, mutui, affitti, accesso al credito e altro) (2/4);2020-03-17 20:36:55+00:00;41;128;;;
727;https://twitter.com/matteosalvinimi/status/1240014267753127936;matteosalvinimi; EMAIL EMERGENZA ECONOMICA CORONAVIRUS Ho ricevuto e stiamo ricevendo migliaia di messaggi e di richieste. Dall'opposizione facciamo il possibile. (1/4);2020-03-17 20:36:54+00:00;162;616;;;
728;https://twitter.com/matteosalvinimi/status/1239989480125272064;matteosalvinimi;Svuota-carceri e amnistie per migliaia di spacciatori e delinquenti? Se qualcuno pensa di usare l'emergenza sanitaria per far passare delle schifezze non avrà MAI il consenso della Lega.;2020-03-17 18:58:24+00:00;195;954;;;
729;https://twitter.com/matteosalvinimi/status/1239973924407930882;matteosalvinimi;#Salvini: Noi non potevamo chiudere le frontiere, abbiamo dovuto aprire tutto a tutti. Ora molti Paesi chiudono senza troppi problemi: dimostrazione che volere è potere. #Schengen #COVID2019;2020-03-17 17:56:35+00:00;429;1990;;#Salvini #Schengen #COVID2019;
730;https://twitter.com/matteosalvinimi/status/1239973603073863685;matteosalvinimi;#Salvini: #annobiancofiscale in Italia. #zonarossaeuropea: trattamenti sanitari e iniziative commerciali uguali in Europa. Anche Presidente Commissione UE ha accennato. Ma, ad ora, questa UE si sta dimostrando inutile e nemica. #COVID2019;2020-03-17 17:55:19+00:00;95;464;;#Salvini #annobiancofiscale #zonarossaeuropea #COVID2019;
731;https://twitter.com/matteosalvinimi/status/1239973523390525452;matteosalvinimi;"Quando l'Europa aveva bisogno l'Italia ha sempre dato. Ora che siamo noi a chiedere aiuto ogni Paese inizia a chiudere le proprie frontiere. Una volta finita questa emergenza sarà necessario ripensare questa ""unione"".";2020-03-17 17:55:00+00:00;245;1028;;;
732;https://twitter.com/matteosalvinimi/status/1239972156630433797;matteosalvinimi;#Salvini: La mail per mandare le vostre domande è emergenza@legaonline.it! Il Decreto ancora non c'è, ma iniziamo a raccogliere dubbi, li smisteremo opportunamente per competenza ai nostri tecnici. #COVID2019;2020-03-17 17:49:34+00:00;91;376;;#Salvini #COVID2019;
733;https://twitter.com/matteosalvinimi/status/1239971691326877696;matteosalvinimi;#Salvini: Per cassa integrazione anche per i piccoli e piccolissimi (proposta della Lega che è stata accolta) pare ci sia la cifra di 1,3 miliardi che non soddisferà nemmeno un 10% delle richieste. #COVID2019;2020-03-17 17:47:43+00:00;89;417;;#Salvini #COVID2019;
734;https://twitter.com/matteosalvinimi/status/1239970887719211009;matteosalvinimi;#Salvini: Vicinanza a Attilio Fontana che lavora per realizzare un MIRACOLO ITALIANO: costruire un ospedale in tempi rapidissimi, creare 500 posti letto per salvare vite. Un abbraccio anche a Luca Zaia, tra i primi a lanciare l'allarme. #COVID2019;2020-03-17 17:44:31+00:00;101;676;;#Salvini #COVID2019;
735;https://twitter.com/matteosalvinimi/status/1239970385065439235;matteosalvinimi;#Salvini: Piuttosto chiediamo indietro i 58 miliardi di euro mandati dagli italiani ai Fondi Europei per salvare le banche degli altri. Altro che MES. #COVID2019;2020-03-17 17:42:31+00:00;458;1901;;#Salvini #COVID2019;
736;https://twitter.com/matteosalvinimi/status/1239969706775199745;matteosalvinimi;"#Salvini: Amiche e Amici, ve lo chiedo a nome degli imprenditori in difficoltà: compriamo italiano, mangiamo, beviamo italiano! E quando si potrà: ""viaggiamo"" italiano. #COVID2019";2020-03-17 17:39:50+00:00;187;1071;;#Salvini #COVID2019;
737;https://twitter.com/matteosalvinimi/status/1239969004891955205;matteosalvinimi;#Salvini: Nessun taglio delle tasse previsto. Si parla di sospensioni. Male. Chi non è coinvolto direttamente dalle chiusure e fattura più di 2M deve pagare lo stesso con un posticipo di soli 4 giorni. Per gli altri i pagamenti sarebbero sospesi fino a fine maggio. #COVID2019;2020-03-17 17:37:02+00:00;69;367;;#Salvini #COVID2019;
738;https://twitter.com/matteosalvinimi/status/1239968292741115906;matteosalvinimi;#Salvini: Come chiediamo di chiudere tutto ciò che non è strategico, chiediamo di CHIUDERE LE CELLE. Aiutando detenuti a star bene, con le mascherine. Aiutando i POLIZIOTTI a star bene, con le mascherine. CERTEZZA DELLA PENA è valore imprescindibile. #COVID2019;2020-03-17 17:34:13+00:00;78;543;;#Salvini #COVID2019;
739;https://twitter.com/matteosalvinimi/status/1239968103376670724;matteosalvinimi;"#Salvini: Viene raccolto positivamente dalla Lega lo spirito costruttivo e propositivo. MA se qualcuno pensa di usare Emergenza per far passare delle schifezze in Parlamento non avrà il consenso della Lega. Esempio? Indulti e ""Svuota carceri"" mascherati. #COVID2019";2020-03-17 17:33:27+00:00;131;587;;#Salvini #COVID2019;
740;https://twitter.com/matteosalvinimi/status/1239967923566854145;matteosalvinimi;#Salvini: La Lega attiva un servizio gratuito per rispondere alle vostre domande. Metteremo a disposizione i nostri tecnici con numeri di cellulare ed un indirizzo mail. Cercheremo di dare risposte precise. #COVID2019;2020-03-17 17:32:45+00:00;209;999;;#Salvini #COVID2019;
741;https://twitter.com/matteosalvinimi/status/1239966752169066504;matteosalvinimi;su quello che stiamo facendo insieme a voi per guarire e rilanciare la nostra splendida Italia. #celafaremo;2020-03-17 17:28:05+00:00;28;219;;#celafaremo;
742;https://twitter.com/matteosalvinimi/status/1239966749019103233;matteosalvinimi;In attesa del Decreto (che tutti aspettano ormai da due giorni) e dopo aver sentito decine di Sindaci e Governatori, alcune riflessioni sull’assurdo SVUOTA-CARCERI, sul Mes e sull’Europa, LIVE https://www.facebook.com/salviniofficial/videos/2503579683304546/;2020-03-17 17:28:05+00:00;67;328;;;
743;https://twitter.com/matteosalvinimi/status/1239965790071181312;matteosalvinimi;#Salvini: Il Decreto ancora non c'è. Non c'è nulla di scritto. Suggerire miglioramenti, emendare, laddove non c'è un testo scritto è difficile.;2020-03-17 17:24:16+00:00;82;498;;#Salvini;
744;https://twitter.com/matteosalvinimi/status/1239945575153504257;matteosalvinimi;Ecco come il Veneto sta fronteggiando l’emergenza Coronavirus: le parole di @zaiapresidente, da ascoltare. LIVE https://www.facebook.com/salviniofficial/videos/2502019253371628/;2020-03-17 16:03:56+00:00;99;501;@zaiapresidente;;
745;https://twitter.com/matteosalvinimi/status/1239920455189852161;matteosalvinimi;#Salvini: C'è in progetto di fare ospedali da campo in alcuni padiglioni fieristici anche in alcune province lombarde. Ovviamente servono uomini e materiale, vediamo di fare il possibile.;2020-03-17 14:24:07+00:00;98;550;;#Salvini;
746;https://twitter.com/matteosalvinimi/status/1239920048292147201;matteosalvinimi;#Salvini: Le scuole non sono chiuse. Sono sospese le lezioni, ma per 200mila lavoratori sono aperte: il personale Ata o i presidi devono andare a scuola. Ma che senso ha mandare in #scuolechiuse centinaia di migliaia di lavoratori esponendoli a rischi?;2020-03-17 14:22:30+00:00;85;638;;#Salvini #scuolechiuse;
747;https://twitter.com/matteosalvinimi/status/1239919033585217538;matteosalvinimi;"#Salvini: Il mondo dei Liberi professionisti è totalmente scoperto: ""Con 600 euro al mese non paghiamo neanche le spese"".";2020-03-17 14:18:28+00:00;117;581;;#Salvini;
748;https://twitter.com/matteosalvinimi/status/1239918877267636227;matteosalvinimi;#Salvini: Il Decreto non c'è ancora. Commentiamo da due giorni delle voci. Ad oggi il decreto non è ancora scritto, non c'è sulla Gazzetta Ufficiale. Anche noi della Lega che sentiamo tutte le categorie siamo in difficoltà senza un testo scritto.;2020-03-17 14:17:51+00:00;107;546;;#Salvini;
749;https://twitter.com/matteosalvinimi/status/1239918110091640833;matteosalvinimi;#Salvini: L'Italia fino a due mesi fa doveva accogliere e aiutare mezzo mondo, quando è stata l'Italia ad avere bisogno? Porte chiuse in faccia. Non si fa così. Se è questa la solidarietà europea, ce ne ricorderemo.;2020-03-17 14:14:48+00:00;1065;5085;;#Salvini;
750;https://twitter.com/matteosalvinimi/status/1239918084103733249;matteosalvinimi;#Salvini: Se dall'Europa ti arriva poco e nulla bisogna rimboccarsi le maniche e fare in casa propria. Ma una volta sconfitta questa brutta bestia, dovremo valutare chi ha fatto e chi non ha fatto, chi ha aiutato e chi no.;2020-03-17 14:14:42+00:00;207;1175;;#Salvini;
751;https://twitter.com/matteosalvinimi/status/1239917613561589761;matteosalvinimi;#Salvini: Su tamponi a tappeto Zaia ha detto che se ne frega del Bilancio? Bene, in emergenza l'unica cosa su cui non puoi risparmiare è la Salute. Sconcerto per alcune prese di posizione UE, presidente Bce e altri commissari non hanno capito che tipo di emergenza c'è in Italia.;2020-03-17 14:12:50+00:00;176;905;;#Salvini;
752;https://twitter.com/matteosalvinimi/status/1239916801531817988;matteosalvinimi;#Salvini: La cifra di 25 miliardi non è lontanamente sufficiente. Se solo il settore Fiori e Piante chiede un miliardo... altro che 25 miliardi.;2020-03-17 14:09:36+00:00;81;461;;#Salvini;
753;https://twitter.com/matteosalvinimi/status/1239916792526626816;matteosalvinimi;#Salvini: Sarebbe un miracolo italiano aprire un ospedale da 500 posti letto nei padiglioni della Fiera di Milano in poco tempo. @FontanaPres sta lavorando.;2020-03-17 14:09:34+00:00;72;482;@FontanaPres;#Salvini;
754;https://twitter.com/matteosalvinimi/status/1239916126890594305;matteosalvinimi;#Salvini: Ieri notte Regione Lombardia è arrivata ai limiti del collasso: finiti tutti i letti di terapia intensiva e i respiratori. Governatore Fontana sta facendo miracoli, arrivati 40 ventilatori polmonari, per prossime ore il servizio è garantito. È una continua rincorsa.;2020-03-17 14:06:55+00:00;215;1020;;#Salvini;
755;https://twitter.com/matteosalvinimi/status/1239912541440151552;matteosalvinimi;Bisogna intervenire subito a tutela di tutti i nostri cari che sono più fragili e indifesi. Servono medici, anche militari, e invio immediato delle protezioni contro il contagio. Scriverò anche al presidente del Consiglio per sensibilizzarlo sulla questione. (3/3);2020-03-17 13:52:40+00:00;68;373;;;
756;https://twitter.com/matteosalvinimi/status/1239912539821158403;matteosalvinimi;Ci risulta - ne ho parlato personalmente con il vicesindaco Filippo Saltamartini -, che sia stato chiesto aiuto da giovedì scorso ma né dalla regione Marche, né dalla Protezione civile sono arrivate risposte concrete. (2/3);2020-03-17 13:52:40+00:00;62;333;;;
757;https://twitter.com/matteosalvinimi/status/1239912538114002945;matteosalvinimi;Abbiamo segnalazioni preoccupanti di case di riposo, come quella di Cingoli in provincia di Macerata, dove tutti i 40 ospiti hanno contratto il #Coronavirus ma mancano medici, mascherine, guanti e altri presidi per evitare ulteriori contagi. (1/3);2020-03-17 13:52:40+00:00;126;550;;#Coronavirus;
758;https://twitter.com/matteosalvinimi/status/1239905470699225089;matteosalvinimi;Nuovi aggiornamenti sull’emergenza coronavirus in Lombardia, ecco le parole del governatore @FontanaPres. LIVE https://www.facebook.com/salviniofficial/videos/656682935123127/;2020-03-17 13:24:35+00:00;69;330;@FontanaPres;;
759;https://twitter.com/matteosalvinimi/status/1239881603503083522;matteosalvinimi;La certezza della pena è fondamentale, soprattutto dopo le rivolte nelle prigioni che hanno causato morti, feriti ed evasioni. Il nostro pensiero va agli agenti della Polizia Penitenziaria, troppo spesso dimenticati e trattati peggio dei detenuti. (2/2);2020-03-17 11:49:44+00:00;139;900;;;
760;https://twitter.com/matteosalvinimi/status/1239881601925996545;matteosalvinimi;Mandare a casa i detenuti fino a 18 mesi di pena come propone il governo? La Lega è assolutamente contraria a qualsiasi sconto di pena, amnistia, indulto o uscita dal carcere anticipata. (1/2);2020-03-17 11:49:44+00:00;376;2109;;;
761;https://twitter.com/matteosalvinimi/status/1239860454769426432;matteosalvinimi;Serve più coraggio per tutelare chi è meno garantito, piccole imprese, lavoratori autonomi e partite IVA, ma anche precari, interinali, stagionali. Il 2020 deve diventare un #annobianco fiscale. (2/2);2020-03-17 10:25:42+00:00;103;595;;#annobianco;
762;https://twitter.com/matteosalvinimi/status/1239860452210946048;matteosalvinimi;Con 600 euro “una tantum” cosa fai? Se non si incassa e non si fattura, come si possono pagare tutte le scadenze in un colpo solo in giugno? Questo mi state scrivendo in tantissimi. (1/2);2020-03-17 10:25:41+00:00;345;1624;;;
763;https://twitter.com/matteosalvinimi/status/1239849032052346880;matteosalvinimi;In questo difficile momento, oggi più che mai, gli Italiani dimostreranno di essere un grande Popolo, che condivide sofferenza, impegno, ingegno, speranza e che non si arrende #orgoglioitaliano #17marzo #unitàdItalia;2020-03-17 09:40:19+00:00;238;1102;;#orgoglioitaliano #17marzo #unit;
764;https://twitter.com/matteosalvinimi/status/1239839280115171328;matteosalvinimi;Ieri il governatore Fontana e Guido Bertolaso alla Fiera Milano per il primo sopralluogo dei padiglioni dove sarà allestito l'ospedale di emergenza per il Coronavirus, una struttura che si vuole realizzare in tempi record e che servirà non solo alla Lombardia, ma a tutta Italia.;2020-03-17 09:01:34+00:00;292;1219;;;
765;https://twitter.com/matteosalvinimi/status/1239678134930345989;matteosalvinimi;Bergamo oggi soffre, ma niente potrà mai spezzarla. Non mollare, Grande Cuore Bergamasco! L’Italia è con te. #Siamotuttibergamaschi;2020-03-16 22:21:14+00:00;488;2529;;#Siamotuttibergamaschi;
766;https://twitter.com/matteosalvinimi/status/1239661989737234439;matteosalvinimi;Eh già... Ricordate?;2020-03-16 21:17:04+00:00;1003;4150;;;
767;https://twitter.com/matteosalvinimi/status/1239650984277823489;matteosalvinimi;#Salvini: Quando Europa aveva bisogno dell'Italia eravamo chiamati a dare soldi per aiutare tutti: dalla Grecia al fondo del MES. Quando è l'Italia ad aver bisogno: tante PAROLE, ma fatti POCHI. #Tg2Post;2020-03-16 20:33:20+00:00;186;889;;#Salvini #Tg2Post;
768;https://twitter.com/matteosalvinimi/status/1239650815826149377;matteosalvinimi;"#Salvini: Serve ripensare a questa Unione Europea che è ""Unione"" quando serve a qualcuno e non è ""Unione"" quando ad aver bisogno è l'Italia. #Tg2Post";2020-03-16 20:32:40+00:00;217;1029;;#Salvini #Tg2Post;
769;https://twitter.com/matteosalvinimi/status/1239650420269690881;matteosalvinimi;#Salvini: Ringrazio per l'impegno i governatori di Lombardia e Veneto. Per primi lanciarono l'allarme, e furono da qualcuno ignorati, attaccati, e in alcuni casi DERISI. Ora siamo in trincea a combattere tutti insieme. #Tg2Post;2020-03-16 20:31:06+00:00;121;652;;#Salvini #Tg2Post;
770;https://twitter.com/matteosalvinimi/status/1239646384342683648;matteosalvinimi;#Salvini: C'è tutto un mondo che non viene tutelato dalle garanzie del governo come le p.iva o i lavoratori stagionali. #Tg2Post;2020-03-16 20:15:04+00:00;84;572;;#Salvini #Tg2Post;
771;https://twitter.com/matteosalvinimi/status/1239646206206382080;matteosalvinimi;#Salvini: #siamotuttibergamaschi non solo a parole, popolo fiero e che non china mai la testa. Il popolo che ora sta soffrendo di più, e sta combattendo di più. Stiamo lavorando in continuazione per garantire materiali e presidi medici.;2020-03-16 20:14:21+00:00;95;655;;#Salvini #siamotuttibergamaschi;
772;https://twitter.com/matteosalvinimi/status/1239645787526696962;matteosalvinimi;#Salvini: Pare che per sospensione dei mutui p.iva e autonomi debbano certificare che incasseranno il 33% in meno rispetto all'anno precedente. Ma come fanno a saperlo nel bel mezzo di una crisi? #Tg2Post;2020-03-16 20:12:41+00:00;90;502;;#Salvini #Tg2Post;
773;https://twitter.com/matteosalvinimi/status/1239645627060977664;matteosalvinimi;#Salvini: Stiamo raccogliendo le continue SEGNALAZIONI dei cittadini, degli artigiani, piccoli imprenditori, delle partite iva, dei lavoratori autonomi e le stiamo trasformando in PROPOSTE da portare al governo. #Tg2Post;2020-03-16 20:12:03+00:00;78;485;;#Salvini #Tg2Post;
774;https://twitter.com/matteosalvinimi/status/1239644994182369281;matteosalvinimi;#Salvini: Cassa integrazione copre 9 settimane, due mesi. L'economia non ripartirà il primo giugno. #Tg2Post;2020-03-16 20:09:32+00:00;73;475;;#Salvini #Tg2Post;
775;https://twitter.com/matteosalvinimi/status/1239644723058532355;matteosalvinimi;#Salvini: Ancora questa mattina ho chiamato il Presidente del Consiglio portando le istanze dei cittadini. Qualche nostra proposta è stata presa in considerazione, ma non basta. #Tg2Post;2020-03-16 20:08:28+00:00;88;566;;#Salvini #Tg2Post;
776;https://twitter.com/matteosalvinimi/status/1239643839872348162;matteosalvinimi;Ora in diretta su Rai Due, cerchiamo di capire di più del decreto del governo. Purtroppo dall’Europa tanto fumo, zero arrosto. Nel frattempo, dopo Germania e Spagna, anche la Francia chiude i confini. #Tg2Post @tg2rai LIVE https://www.facebook.com/salviniofficial/videos/829410267531534/;2020-03-16 20:04:57+00:00;70;369;@tg2rai;#Tg2Post;
777;https://twitter.com/matteosalvinimi/status/1239623923676971009;matteosalvinimi;#Salvini: Alcuni Sindaci Lega stanno sospendendo tasse comunali sui servizi che non possono erogare: rette asili nido, rette scuolabus, rette scuola materne, tasse di soggiorno, tasse comunali. Cercheremo di inserire nel Decreto aiuti per i comuni e per i Sindaci.;2020-03-16 18:45:49+00:00;189;952;;#Salvini;
778;https://twitter.com/matteosalvinimi/status/1239623432461004800;matteosalvinimi;#Salvini: Alcuni interventi economici sono insufficienti: un contributo una tantum di 600 euro ai lavoratori autonomi, nemmeno a tutti, non basta per un mese. È chiaro a tutti.;2020-03-16 18:43:52+00:00;119;651;;#Salvini;
779;https://twitter.com/matteosalvinimi/status/1239623349137014784;matteosalvinimi;#Salvini: Altre proposte non sono state considerate, cercheremo di inserirle quando decreto sarà in Discussione: sospensione ISA, annullamento #plastictax e #sugartax...;2020-03-16 18:43:32+00:00;62;358;;#Salvini #plastictax #sugartax;
780;https://twitter.com/matteosalvinimi/status/1239623196451667971;matteosalvinimi;#Salvini: La cassa integrazione concessa anche ai piccoli (Liberi professionisti, artigiani con un solo dipendente, commercianti).;2020-03-16 18:42:55+00:00;57;364;;#Salvini;
781;https://twitter.com/matteosalvinimi/status/1239623157562163201;matteosalvinimi;#Salvini: come Lega abbiamo proposto #annobiancofiscale. Per il 2020. Si può fare, è stato fatto in altri Paesi in occasione di gravi emergenze.;2020-03-16 18:42:46+00:00;95;507;;#Salvini #annobiancofiscale;
782;https://twitter.com/matteosalvinimi/status/1239621521393553409;matteosalvinimi;#Salvini: Piccola soddisfazione: alcune proposte della Lega sono state accolte come alzare da 400mila a 2milioni di euro tetto di fatturato per la sospensione dei versamenti fiscali.;2020-03-16 18:36:16+00:00;100;579;;#Salvini;
783;https://twitter.com/matteosalvinimi/status/1239612981219975168;matteosalvinimi;Non ci possono essere Italiani di Serie B. GRAZIE agli Angeli degli ospedali. (2/2);2020-03-16 18:02:20+00:00;64;386;;;
784;https://twitter.com/matteosalvinimi/status/1239612979047522306;matteosalvinimi;Stipendi, affitti, mutui, versamento di Iva e contributi, cassa integrazione, sostegno ad autonomi e partite Iva, bonus a famiglie e imprese. Stiamo lavorando per migliorare un Decreto che può e deve aiutare TUTTI a rialzarsi. (1/2) LIVE https://www.facebook.com/salviniofficial/videos/570433583564788/;2020-03-16 18:02:19+00:00;97;553;;;
785;https://twitter.com/matteosalvinimi/status/1239607020019494914;matteosalvinimi;In un mondo normale la governatrice della BCE si sarebbe già dimessa. Evidentemente, in questa Europa, chi sbaglia non paga.;2020-03-16 17:38:39+00:00;831;3379;;;
786;https://twitter.com/matteosalvinimi/status/1239595651933122560;matteosalvinimi;.@FontanaPres ci aggiorna sulla situazione in Lombardia. LIVE https://www.facebook.com/salviniofficial/videos/613212335924304/;2020-03-16 16:53:28+00:00;62;386;@FontanaPres;;
787;https://twitter.com/matteosalvinimi/status/1239586764269944835;matteosalvinimi;.@zaiapresidente ci dà tutti gli aggiornamenti sull’emergenza #Coronavirus in Veneto. LIVE https://www.facebook.com/salviniofficial/videos/808932619629542/;2020-03-16 16:18:09+00:00;63;337;@zaiapresidente;#Coronavirus;
788;https://twitter.com/matteosalvinimi/status/1239569395153764353;matteosalvinimi;In assenza di lavoro, se un imprenditore o una commerciante non riesce a pagare l'Iva o i contributi adesso non potrà farlo nemmeno a maggio. Il 2020 deve essere un anno bianco fiscale: chi non incassa, non paga.;2020-03-16 15:09:08+00:00;684;2851;;;
789;https://twitter.com/matteosalvinimi/status/1239537409764855808;matteosalvinimi;Pausa fra le telefonate a sindaci e imprenditori, si lavora per cercare macchinari per ospedali, camici e mascherine. P.s. Oggi più che mai: compriamo e mangiamo italiano.;2020-03-16 13:02:02+00:00;143;1115;;;
790;https://twitter.com/matteosalvinimi/status/1239520675066454017;matteosalvinimi;Lo diciamo con spirito costruttivo e senza polemiche. (3/3);2020-03-16 11:55:32+00:00;72;493;;;
791;https://twitter.com/matteosalvinimi/status/1239520673728475136;matteosalvinimi;Abbiamo letto sui giornali qualche anticipazione - e spero non sia vero - sul fatto che a partite Iva, commercianti, artigiani, chi lavora in proprio verrà dato un contributo “una tantum” di 600 euro, con questo non si risolve nulla. (2/3);2020-03-16 11:55:32+00:00;117;671;;;
792;https://twitter.com/matteosalvinimi/status/1239520670939254785;matteosalvinimi;Ho sentito il presidente Conte e ho chiesto certezza sui tempi del decreto economico. È urgente dare garanzie entro oggi a tutti coloro che hanno chiuso e che non ce la fanno, come Lega abbiamo fatto decine di proposte al governo, speriamo che almeno una parte venga accolta.(1/3);2020-03-16 11:55:31+00:00;165;1000;;;
793;https://twitter.com/matteosalvinimi/status/1239496018376491009;matteosalvinimi;#Salvini: Ricordiamocelo sempre: NOI SIAMO L'ITALIA. ;2020-03-16 10:17:34+00:00;172;1061;;#Salvini;
794;https://twitter.com/matteosalvinimi/status/1239495705686917121;matteosalvinimi;#Salvini: Un pensiero particolare ai disabili, ai malati cronici, agli immunodepressi. Stiamo cercando di avere con i nostri amministratori un occhio di riguardo per loro: assistenza domiciliare, nel rispetto delle procedure.;2020-03-16 10:16:19+00:00;100;623;;#Salvini;
795;https://twitter.com/matteosalvinimi/status/1239495221081190401;matteosalvinimi;#Salvini: Sì, confesso. Ieri sono andato a piedi a fare la spesa sotto casa con la mia fidanzata. Possono andarci solo quelli di sinistra? Confesso di aver comprato pane, pasta, latte e formaggio. Italiani.;2020-03-16 10:14:24+00:00;772;6960;;#Salvini;
796;https://twitter.com/matteosalvinimi/status/1239492883557867521;matteosalvinimi;#SIAMOTUTTIBERGAMASCHI;2020-03-16 10:05:06+00:00;78;420;;#SIAMOTUTTIBERGAMASCHI;
797;https://twitter.com/matteosalvinimi/status/1239492412587814913;matteosalvinimi;#Salvini: Come Lega abbiamo proposto l'#annobianco fiscale per il 2020. Chi non incassa, non paga. Chi non fattura, non paga. Chi non produce, non paga. Non puoi pagare su ciò che non fai.;2020-03-16 10:03:14+00:00;494;2213;;#Salvini #annobianco;
798;https://twitter.com/matteosalvinimi/status/1239492022349807622;matteosalvinimi;#Salvini: L'Italia sta dimostrando che è un grande Paese, da Nord a Sud. Unita nel sacrifico e nella solidarietà. ;2020-03-16 10:01:41+00:00;84;570;;#Salvini;
799;https://twitter.com/matteosalvinimi/status/1239491347490496512;matteosalvinimi;#Salvini: il grande popolo di chi lavora in proprio deve avere esattamente tutte le garanzie che hanno gli altri.;2020-03-16 09:59:00+00:00;82;494;;#Salvini;
800;https://twitter.com/matteosalvinimi/status/1239490974759477248;matteosalvinimi;#Salvini: Spero non sia vero che ai piccoli, alle p.iva, venga dato un contributo una tantum di 600 euro. Così non si va da nessuna parte.;2020-03-16 09:57:31+00:00;115;600;;#Salvini;
801;https://twitter.com/matteosalvinimi/status/1239490494134128641;matteosalvinimi;#Salvini: L'obiettivo è chiudere tutto ciò che non è strategico.;2020-03-16 09:55:37+00:00;92;652;;#Salvini;
