id;permalink;username;text;date;retweet;favorite;mentions;hashtag;geo
0;https://twitter.com/sole24ore/status/1223724443899498498;sole24ore;Coronavirus, gli analisti del lusso: «Ecco perché mette a rischio la crescita del 2020» https://www.ilsole24ore.com/art/coronavirus-analisti-lusso-ecco-perche-mette-rischio-crescita-2020-ACePXLGB?utm_term=Autofeed&amputm_medium=TWSole24Ore&amputm_source=Twitter#Echobox=1580591485;2020-02-01 21:46:57+00:00;0;4;;;
1;https://twitter.com/sole24ore/status/1223701418822991875;sole24ore;Coronavirus, allerta rating: il 33% della crescita globale dipende dalla Cina https://www.ilsole24ore.com/art/coronavirus-allerta-rating-33percento-crescita-globale-dipende-cina-ACz3ROGB?utm_term=Autofeed&amputm_medium=TWSole24Ore&amputm_source=Twitter#Echobox=1580587149;2020-02-01 20:15:28+00:00;9;11;;;
2;https://twitter.com/sole24ore/status/1223682791013076996;sole24ore;#Coronavirus, le notizie fondamentali di oggi https://bit.ly/2UiauhW;2020-02-01 19:01:26+00:00;3;6;;#Coronavirus;
3;https://twitter.com/sole24ore/status/1223667225539874817;sole24ore;Coronavirus, gli analisti del lusso: «Ecco perché mette a rischio la crescita del 2020» https://www.ilsole24ore.com/art/coronavirus-analisti-lusso-ecco-perche-mette-rischio-crescita-2020-ACePXLGB?utm_term=Autofeed&amputm_medium=TWSole24Ore&amputm_source=Twitter#Echobox=1580578283;2020-02-01 17:59:35+00:00;1;5;;;
4;https://twitter.com/sole24ore/status/1223665185266839552;sole24ore;#Coronavirus, da lunedì al via rimpatri da e per la Cina @sole24ore;2020-02-01 17:51:29+00:00;1;5;@sole24ore;#Coronavirus;
5;https://twitter.com/sole24ore/status/1223649544241668097;sole24ore;#Coronavirus, viaggio nella Chinatown milanese che teme il boicottaggio https://24plus.ilsole24ore.com/art/magnani-on-the-road-caccia-cinesi-AC8ieCGB?utm_medium=TWSole24Ore&amputm_source=Twitter#Echobox=1580572579;2020-02-01 16:49:20+00:00;4;1;;#Coronavirus;
6;https://twitter.com/sole24ore/status/1223646072205201408;sole24ore;Coronavirus, ecco perché l'Italia ha adottato misure più stringenti rispetto al resto Ue https://www.ilsole24ore.com/art/coronavirus-ecco-perche-italia-ha-adottato-misure-piu-stringenti-rispetto-resto-ue-ACamuLGB?utm_term=Autofeed&amputm_medium=TWSole24Ore&amputm_source=Twitter#Echobox=1580572446;2020-02-01 16:35:32+00:00;5;12;;;
7;https://twitter.com/sole24ore/status/1223644364737478666;sole24ore;#Coronavirus, la comunità cinese: non tutte attività resisteranno @sole24ore https://www.ilsole24ore.com/art/corona-virus-ultimi-aggiornamenti-AC9iaFGB#U1580572800170;2020-02-01 16:28:45+00:00;1;5;@sole24ore;#Coronavirus;
8;https://twitter.com/sole24ore/status/1223641962013777920;sole24ore;#Coronavirus, Iss: mascherine inutili per chi è sano @sole24ore https://www.ilsole24ore.com/art/corona-virus-ultimi-aggiornamenti-AC9iaFGB#U1580566453182;2020-02-01 16:19:12+00:00;7;14;@sole24ore;#Coronavirus;
9;https://twitter.com/sole24ore/status/1223622960747106304;sole24ore;Sintomi, periodo d'incubazione, modalità di contagio: tutto quello che devi sapere sul #coronavirus. L'analisi su 24+, sezione premium del Sole 24 Ore https://24plus.ilsole24ore.com/art/e-anziano-e-patologie-pregresse-chi-si-ammala-coronavirus-ACf7h0FB?utm_medium=TWSole24Ore&amputm_source=Twitter#Echobox=1580556981;2020-02-01 15:03:42+00:00;4;6;;#coronavirus;
10;https://twitter.com/sole24ore/status/1223600744072384513;sole24ore;#Coronavirus. Banca centrale Cina, assicuriamo sostegno a mercati @sole24ore https://www.ilsole24ore.com/art/corona-virus-ultimi-aggiornamenti-AC9iaFGB#U1580563659388;2020-02-01 13:35:25+00:00;1;4;@sole24ore;#Coronavirus;
11;https://twitter.com/sole24ore/status/1223600678293188609;sole24ore;#Coronavirus. In Lombardia 33 controllati negativi @sole24ore https://www.ilsole24ore.com/art/corona-virus-ultimi-aggiornamenti-AC9iaFGB#U1580563126378;2020-02-01 13:35:09+00:00;3;6;@sole24ore;#Coronavirus;
12;https://twitter.com/sole24ore/status/1223597797854908418;sole24ore;#Coronavirus, #Oms in campo contro falsi miti e fake news @sole24ore https://www.ilsole24ore.com/art/corona-virus-ultimi-aggiornamenti-AC9iaFGB#U1580562996277;2020-02-01 13:23:43+00:00;4;5;@sole24ore;#Coronavirus #Oms;
13;https://twitter.com/sole24ore/status/1223597321604227072;sole24ore;Wall Street, trimestrali migliori delle attese ma pesa l'ombra del coronavirus https://www.ilsole24ore.com/art/wall-street-trimestrali-migliori-attese-ma-pesa-ombra-coronavirus-AC6I0JGB?utm_medium=TWSole24Ore&amputm_source=Twitter#Echobox=1580544646;2020-02-01 13:21:49+00:00;4;3;;;
14;https://twitter.com/sole24ore/status/1223576812766269446;sole24ore;#Coronavirus. Condizioni coppia a Roma restano discrete @sole24ore https://www.ilsole24ore.com/art/corona-virus-ultimi-aggiornamenti-AC9iaFGB#U1580556778084;2020-02-01 12:00:19+00:00;1;4;@sole24ore;#Coronavirus;
15;https://twitter.com/sole24ore/status/1223570396584271872;sole24ore;#Coronavirus, #Londra riduce personale diplomatico in Cina @sole24ore https://www.ilsole24ore.com/art/corona-virus-ultimi-aggiornamenti-AC9iaFGB#U1580553124559;2020-02-01 11:34:50+00:00;1;3;@sole24ore;#Coronavirus #Londra;
16;https://twitter.com/sole24ore/status/1223570176748195841;sole24ore;#Coronavirus: due cinesi senza sintomi in isolamento volontario a Trento @sole24ore https://www.ilsole24ore.com/art/corona-virus-ultimi-aggiornamenti-AC9iaFGB#U1580554592062;2020-02-01 11:33:57+00:00;4;12;@sole24ore;#Coronavirus;
17;https://twitter.com/sole24ore/status/1223570058062049280;sole24ore;Boccia (@Confindustria): #coronavirus rallenta economia, possiamo reagire @sole24ore https://www.ilsole24ore.com/art/corona-virus-ultimi-aggiornamenti-AC9iaFGB#U1580550602575;2020-02-01 11:33:29+00:00;1;1;@Confindustria @sole24ore;#coronavirus;
18;https://twitter.com/sole24ore/status/1223569031216713728;sole24ore;Il #Coronavirus minaccia l'economia globale: turismo e moda i settori a rischio - https://stream24.ilsole24ore.com/video/economia/il-coronavirus-contagia-economia/AC6beKGB?utm_medium=TWSole24Ore&amputm_source=Twitter#Echobox=1580554160;2020-02-01 11:29:24+00:00;4;3;;#Coronavirus;
19;https://twitter.com/sole24ore/status/1223555473925922816;sole24ore;#Coronavirus. #Australia limita arrivi da #Cina @sole24ore https://www.ilsole24ore.com/art/corona-virus-ultimi-aggiornamenti-AC9iaFGB#U1580549304057;2020-02-01 10:35:32+00:00;3;3;@sole24ore;#Coronavirus #Australia #Cina;
20;https://twitter.com/sole24ore/status/1223555330375868416;sole24ore;#Coronavirus. Vietnam sospende voli da e per Cina @sole24ore;2020-02-01 10:34:57+00:00;2;3;@sole24ore;#Coronavirus;
21;https://twitter.com/sole24ore/status/1223542506039758850;sole24ore;#Coronavirus. #Apple chiude gli store fino al 9 febbraio @sole24ore https://www.ilsole24ore.com/art/corona-virus-ultimi-aggiornamenti-AC9iaFGB#U1580549148170;2020-02-01 09:44:00+00:00;8;6;@sole24ore;#Coronavirus #Apple;
22;https://twitter.com/sole24ore/status/1223540627792650242;sole24ore;#Coronavirus.Tajani: grave responsabilità del regime cinese @sole24ore https://www.ilsole24ore.com/art/corona-virus-ultimi-aggiornamenti-AC9iaFGB#U1580548308879;2020-02-01 09:36:32+00:00;1;7;@sole24ore;#Coronavirus;
23;https://twitter.com/sole24ore/status/1223539911485284352;sole24ore;#Coronavirus. Restano due i casi accertati in Italia @sole24ore https://www.ilsole24ore.com/art/corona-virus-ultimi-aggiornamenti-AC9iaFGB#U1580546288407;2020-02-01 09:33:41+00:00;1;2;@sole24ore;#Coronavirus;
24;https://twitter.com/sole24ore/status/1223539625047797761;sole24ore;#Coronavirus, sale a 259 il bilancio delle vittime in Cina - Stato di emergenza per il virus, un commissario per la crisi @sole24ore https://www.ilsole24ore.com/art/corona-virus-ultimi-aggiornamenti-AC9iaFGB#U1580543142715;2020-02-01 09:32:33+00:00;3;4;@sole24ore;#Coronavirus;
25;https://twitter.com/sole24ore/status/1223511936660205569;sole24ore;La mappa per seguire la diffusione del coronavirus (in tempo reale) http://dlvr.it/RP9JZy;2020-02-01 07:42:32+00:00;13;10;;;
26;https://twitter.com/sole24ore/status/1223378140543758337;sole24ore;Coronavirus, stop ai voli Italia-Cina: che cosa cambia per turismo e affari. Bloccati anche i cargo https://www.ilsole24ore.com/art/coronavirus-stop-voli-italia-cina-che-cosa-cambia-turismo-e-affari-bloccati-anche-cargo-ACdS1BGB?utm_term=Autofeed&amputm_medium=TWSole24Ore&amputm_source=Twitter#Echobox=1580495338;2020-01-31 22:50:52+00:00;5;11;;;
27;https://twitter.com/sole24ore/status/1223331097523687425;sole24ore;Blog | Coronavirus, come informarsi, a chi dare retta e i numeri per ridimensionare l'ansia da social - Info Data https://www.infodata.ilsole24ore.com/2020/01/31/come-informarsi/?utm_medium=TWSole24Ore&amputm_source=Twitter#Echobox=1580478588;2020-01-31 19:43:56+00:00;6;10;;;
28;https://twitter.com/sole24ore/status/1223320272037650433;sole24ore;Le tre notizie fondamentali di oggi sul #CoronaVirus Tra rischi reali e fake news http://s24ore.it/kw4nXr Le mascherine servono davvero? http://s24ore.it/RXlA5N Che cosa cambia per turismo e affari http://s24ore.it/QyMniY;2020-01-31 19:00:55+00:00;3;3;;#CoronaVirus;
29;https://twitter.com/sole24ore/status/1223304757013614592;sole24ore;Coronavirus: chi il sindaco leghista di Civitavecchia che ha detto no allo sbarco dei turisti https://www.ilsole24ore.com/art/coronavirus-chi-sindaco-leghista-civitavecchia-che-ha-detto-no-sbarco-turisti-ACq3T6FB?utm_medium=TWSole24Ore&amputm_source=Twitter#Echobox=1580492605;2020-01-31 17:59:16+00:00;1;14;;;
30;https://twitter.com/sole24ore/status/1223239413456691201;sole24ore;Coronavirus, che cosa significa emergenza globale e che cosa comporta https://www.ilsole24ore.com/art/raccomandazioni-e-coordinamento-cosa-significa-l-emergenza-oms-coronavirus-ACRvQvFB?utm_term=Autofeed&amputm_medium=TWSole24Ore&amputm_source=Twitter#Echobox=1580477204;2020-01-31 13:39:37+00:00;7;9;;;
31;https://twitter.com/sole24ore/status/1223228326350749696;sole24ore;Coronavirus, come informarsi, a chi dare retta e i numeri per ridimensionare l’ansia da social http://dlvr.it/RP6db8;2020-01-31 12:55:34+00:00;6;12;;;
32;https://twitter.com/sole24ore/status/1223223687362596865;sole24ore;Coronavirus, che cosa significa emergenza globale e che cosa comporta https://www.ilsole24ore.com/art/raccomandazioni-e-coordinamento-cosa-significa-l-emergenza-oms-coronavirus-ACRvQvFB?utm_term=Autofeed&amputm_medium=TWSole24Ore&amputm_source=Twitter#Echobox=1580466730;2020-01-31 12:37:08+00:00;5;7;;;
33;https://twitter.com/sole24ore/status/1223197938429636608;sole24ore;Il #coronavirus è arrivato in Italia, ecco come difendersi da rischi reali e #fake news https://www.ilsole24ore.com/art/il-coronavirus-e-arrivato-italia-ecco-come-difendersi-rischi-reali-e-fake-news-ACrTTwFB?utm_medium=TWSole24Ore&amputm_source=Twitter#Echobox=1580467141;2020-01-31 10:54:49+00:00;4;6;;#coronavirus #fake;
34;https://twitter.com/sole24ore/status/1223194757251452928;sole24ore;#Coronavirus, due casi confermati a Roma, uno sospetto in Veneto https://www.ilsole24ore.com/art/coronavirus-due-casi-confermati-roma-sospetto-veneto-AClctuFB?utm_medium=TWSole24Ore&amputm_source=Twitter#Echobox=1580466354;2020-01-31 10:42:10+00:00;2;4;;#Coronavirus;
35;https://twitter.com/sole24ore/status/1223180684665270273;sole24ore;Il coronavirus affonda le navi da crociera (compresi i titoli in Borsa) https://www.ilsole24ore.com/art/il-coronavirus-affonda-navi-crociera-compresi-titoli-borsa-ACIV1hFB?utm_term=Autofeed&amputm_medium=TWSole24Ore&amputm_source=Twitter#Echobox=1580462590;2020-01-31 09:46:15+00:00;4;3;;;
36;https://twitter.com/sole24ore/status/1223123944858738689;sole24ore;La prima pagina del @sole24ore del #31gennaio. In apertura la riforma del #Fisco tratteggiata dal ministro dell’Economia #Gualtieri. Tutte le risposte di #Telefisco2020. #Oms: emergenza globale per il #CoronaVirus. E poi #pensioni #risparmio #moda #buonalettura #rassegnastampa;2020-01-31 06:00:47+00:00;8;9;@sole24ore;#31gennaio #Fisco #Gualtieri #Telefisco2020 #Oms #CoronaVirus #pensioni #risparmio #moda #buonalettura #rassegnastampa;
37;https://twitter.com/sole24ore/status/1223004410101534720;sole24ore;#Coronavirus, primi due casi in Italia. Chiuso traffico aereo con la #Cina. #Oms dichiara l’emergenza globale @sole24ore;2020-01-30 22:05:48+00:00;13;28;@sole24ore;#Coronavirus #Cina #Oms;
38;https://twitter.com/sole24ore/status/1222984071292301312;sole24ore;#CoronaVirus, #OMS dichiara l’emergenza globale @sole24ore https://www.ilsole24ore.com/art/coronavirus-vittime-salgono-170-il-rimpatrio-italiani-ACA72XFB;2020-01-30 20:44:59+00:00;4;17;@sole24ore;#CoronaVirus #OMS;
39;https://twitter.com/sole24ore/status/1222981731155947526;sole24ore;Borse in rosso ma il coronavirus non porterà la recessione globale https://www.ilsole24ore.com/art/borse-rosso-ma-coronavirus-non-portera-recessione-globale-AChoRNFB?utm_term=Autofeed&amputm_medium=TWSole24Ore&amputm_source=Twitter#Echobox=1580404134;2020-01-30 20:35:41+00:00;1;5;;;
40;https://twitter.com/sole24ore/status/1222978627073191937;sole24ore;#CoronaVirus, l’#Oms, Organizzazione mondiale della sanità decreta l’emergenza globale. Ecco gli effetti sull’economia globale https://www.ilsole24ore.com/art/coronavirus-crisi-non-solo-pil-cina-tesla-apple-mondo-col-fiato-sospeso--videoanalisi-ACqtRZFB;2020-01-30 20:23:21+00:00;37;43;;#CoronaVirus #Oms;
41;https://twitter.com/sole24ore/status/1222800720128303104;sole24ore;Coronavirus, le vittime salgono a 170. Verso il rimpatrio degli italiani https://www.ilsole24ore.com/art/coronavirus-vittime-salgono-170-il-rimpatrio-italiani-ACA72XFB?utm_term=Autofeed&amputm_medium=TWSole24Ore&amputm_source=Twitter#Echobox=1580368503;2020-01-30 08:36:24+00:00;2;8;;;
42;https://twitter.com/sole24ore/status/1222635805165981696;sole24ore;Coronavirus, al via il rientro di 60 italiani: spunta ipotesi quarantena in caserma https://www.ilsole24ore.com/art/coronavirus-via-rientro-60-italiani-quarantena-non-automatica-ACeyENFB?utm_term=Autofeed&amputm_medium=TWSole24Ore&amputm_source=Twitter#Echobox=1580322871;2020-01-29 21:41:06+00:00;3;9;;;
43;https://twitter.com/sole24ore/status/1222506258021875718;sole24ore;#coronavirus, ecco requisiti e sintomi per definire un «caso sospetto» https://www.ilsole24ore.com/art/coronavirus-ecco-requisiti-e-sintomi-definire-caso-sospetto-ACr6EFFB?utm_medium=TWSole24Ore&amputm_source=Twitter#Echobox=1580302255;2020-01-29 13:06:19+00:00;14;11;;#coronavirus;
44;https://twitter.com/sole24ore/status/1222501030757306368;sole24ore;Coronavirus, ecco requisiti e sintomi per definire un «caso sospetto» https://www.ilsole24ore.com/art/coronavirus-ecco-requisiti-e-sintomi-definire-caso-sospetto-ACr6EFFB?utm_medium=TWSole24Ore&amputm_source=Twitter#Echobox=1580301877;2020-01-29 12:45:33+00:00;0;7;;;
45;https://twitter.com/sole24ore/status/1222439227247538176;sole24ore;Coronavirus, British Airways interrompe i voli con la Cina. Starbucks chiude metà negozi https://www.ilsole24ore.com/art/virus-cinese-borsa-hong-kong-apre-ribasso-trump-valuta-sospensione-voli-ACHSICFB?utm_medium=TWSole24Ore&amputm_source=Twitter#Echobox=1580286252;2020-01-29 08:39:58+00:00;9;22;;;
46;https://twitter.com/sole24ore/status/1222189357513289729;sole24ore;Coronavirus, l’auto europea scappa dalla Cina https://www.ilsole24ore.com/art/coronavirus-l-auto-europea-scappa-cina-ACOlFxEB?utm_term=Autofeed&amputm_medium=TWSole24Ore&amputm_source=Twitter#Echobox=1580220525;2020-01-28 16:07:04+00:00;6;2;;;
47;https://twitter.com/sole24ore/status/1222185713141256192;sole24ore;Coronavirus: Fiavet sospende i tour turistici verso la Cina https://www.ilsole24ore.com/art/coronavirus-fiavet-sospende-tour-turistici-la-cina-ACR5YhEB?utm_term=Autofeed&amputm_medium=TWSole24Ore&amputm_source=Twitter#Echobox=1580216055;2020-01-28 15:52:35+00:00;1;2;;;
48;https://twitter.com/sole24ore/status/1222132870501847041;sole24ore;Virus cinese, i morti salgono a 106: scuole chiuse e stop ai viaggi all’estero. Ecco la mappa del contagio #CoronaVirus https://www.ilsole24ore.com/art/virus-cinese-morti-salgono-106-scuole-chiuse-e-stop-viaggi-all-estero-AC34btEB;2020-01-28 12:22:37+00:00;12;19;;#CoronaVirus;
49;https://twitter.com/sole24ore/status/1222067612072452096;sole24ore;Borse, il coronavirus cancella i guadagni 2020 dell’Europa, tiene Wall Street https://www.ilsole24ore.com/art/coronavirus-cancella-guadagni-2020-europa-tiene-wall-street-AC77ImEB?utm_term=Autofeed&amputm_medium=TWSole24Ore&amputm_source=Twitter#Echobox=1580197522;2020-01-28 08:03:18+00:00;0;3;;;
50;https://twitter.com/sole24ore/status/1222057913704964096;sole24ore;#Virus cinese, i morti salgono a 106: scuole chiuse e stop ai viaggi all’estero #coronavirus https://www.ilsole24ore.com/art/virus-cinese-morti-salgono-106-scuole-chiuse-e-stop-viaggi-all-estero-AC34btEB?utm_medium=TWSole24Ore&amputm_source=Twitter#Echobox=1580195384;2020-01-28 07:24:46+00:00;6;9;;#Virus #coronavirus;
51;https://twitter.com/sole24ore/status/1221919024986148864;sole24ore;Blog | La mappa della Johns Hopkins University per seguire la diffusione del coronavirus (quasi in tempo reale) - Info Data https://www.infodata.ilsole24ore.com/2020/01/27/la-mappa-della-johns-hopkins-university-seguire-la-diffusione-del-coronavirus-quasi-tempo-reale/?utm_term=Autofeed&amputm_medium=TWSole24Ore&amputm_source=Twitter#Echobox=1580162593;2020-01-27 22:12:52+00:00;12;12;;;
52;https://twitter.com/sole24ore/status/1221917180167483392;sole24ore;La mappa della Johns Hopkins University per seguire la diffusione del coronavirus (quasi in tempo reale) http://dlvr.it/RNsTnn;2020-01-27 22:05:32+00:00;4;13;;;
53;https://twitter.com/sole24ore/status/1221820201081212932;sole24ore;Il coronavirus affonda le Borse, in rosso anche Wall Street. Spread in calo dopo voto https://www.ilsole24ore.com/art/borse-tokyo-ha-chiuso-071percento-listini-europei-attesi-calo-tranne-piazza-affari-ACDZ4FEB?utm_term=Autofeed&amputm_medium=TWSole24Ore&amputm_source=Twitter#Echobox=1580133975;2020-01-27 15:40:10+00:00;6;6;;;
54;https://twitter.com/sole24ore/status/1221793857341444096;sole24ore;Il coronavirus minaccia l’anno del turismo cinese: a rischio 4 milioni di arrivi https://www.ilsole24ore.com/art/il-coronavirus-minaccia-l-anno-turismo-cinese-rischio-4-milioni-arrivi-ACifMeEB?utm_medium=TWSole24Ore&amputm_source=Twitter#Echobox=1580132493;2020-01-27 13:55:30+00:00;1;4;;;
55;https://twitter.com/sole24ore/status/1221147095563931648;sole24ore;Il Coronavirus mette in allarme le boutique del lusso di Roma e Milano https://www.ilsole24ore.com/art/il-coronavirus-mette-allarme-boutique-lusso-roma-e-milano-ACah8FEB?utm_term=Autofeed&amputm_medium=TWSole24Ore&amputm_source=Twitter#Echobox=1579978700;2020-01-25 19:05:30+00:00;4;10;;;
56;https://twitter.com/sole24ore/status/1221143132143804418;sole24ore;Cina, il coronavirus minaccia anche l’economia: 1,2 punti di Pil a rischio https://www.ilsole24ore.com/art/effetto-virus-sull-economia-cinese-sp-12-punti-pil-rischio-ACGyQFEB?utm_term=Autofeed&amputm_medium=TWSole24Ore&amputm_source=Twitter#Echobox=1579977913;2020-01-25 18:49:45+00:00;10;16;;;
57;https://twitter.com/sole24ore/status/1221135641335029770;sole24ore;Il Coronavirus mette in allarme le boutique del lusso di Roma e Milano https://www.ilsole24ore.com/art/il-coronavirus-mette-allarme-boutique-lusso-roma-e-milano-ACah8FEB?utm_term=Autofeed&amputm_medium=TWSole24Ore&amputm_source=Twitter#Echobox=1579971317;2020-01-25 18:19:59+00:00;10;20;;;
58;https://twitter.com/sole24ore/status/1220966409125101568;sole24ore;La prima pagina del @sole24ore di #sabato #25gennaio. in apertura il #cuneofiscale e l‘impatto sulle buste paga dei dipendenti pubblici. #dazi e guerra commerciale, le mosse della #Ue #Blackstone #Rcs, #Cina e #coronavirus e poi #fisco #risparmio e le #elezioni in #EmiliaRomagna;2020-01-25 07:07:31+00:00;6;12;@sole24ore;#sabato #25gennaio #cuneofiscale #dazi #Ue #Blackstone #Rcs #Cina #coronavirus #fisco #risparmio #elezioni #EmiliaRomagna;
59;https://twitter.com/sole24ore/status/1220274539894050816;sole24ore;Dal coronavirus al capodanno: perché la Cina è sempre una priorità del lusso https://www.ilsole24ore.com/art/dal-coronavirus-capodanno-perche-cina-e-sempre-priorita-lusso-ACO3ORDB?utm_term=Autofeed&amputm_medium=TWSole24Ore&amputm_source=Twitter#Echobox=1579770549;2020-01-23 09:18:16+00:00;1;1;;;
60;https://twitter.com/sole24ore/status/1219671311817027587;sole24ore;#coronavirus e gli altri. Tutti i dati, le mappe e gli aggiornamenti del Programma globale per l'influenza che monitora la malattia nel mondo https://www.infodata.ilsole24ore.com/2020/01/21/come-monitorare-le-epidemie-influenzali-in-europa-e-nel-mondo/?utm_medium=TWSole24Ore&amputm_source=Twitter#Echobox=1579609040;2020-01-21 17:21:15+00:00;9;12;;#coronavirus;
