id;permalink;username;text;date;retweet;favorite;mentions;hashtag;geo
91;https://twitter.com/Palazzo_Chigi/status/1229416835138887683;Palazzo_Chigi;#Agenda2023, il Presidente @GiuseppeConteIT questa mattina ha presieduto a Palazzo Chigi i tavoli di lavoro su Scuola, Università, Ricerca e Innovazione digitale e su Salute. Nel pomeriggio, alle 16.30, prenderà il via il tavolo su Sicurezza e immigrazione;2020-02-17 14:46:29+00:00;58;177;@GiuseppeConteIT;#Agenda2023;
92;https://twitter.com/Palazzo_Chigi/status/1229385416425558018;Palazzo_Chigi;Online sul sito del Dipartimento della @FunzPub il “Cruscotto degli scioperi nel pubblico impiego”, dove si possono visualizzare le modalità di svolgimento o di eventuale revoca dello sciopero, il personale delle #PA interessato e altre informazioni;2020-02-17 12:41:38+00:00;5;15;@FunzPub;#PA;
93;https://twitter.com/Palazzo_Chigi/status/1229050890977447936;Palazzo_Chigi;#Agenda2023, il Presidente @GiuseppeConteIT lunedì 17 febbraio presiederà a Palazzo Chigi i tavoli di lavoro su: Scuola, Università, Ricerca e Innovazione digitale Salute Sicurezza e immigrazione http://governo.it/it/articolo/agenda-2023-i-tavoli-di-lavoro-di-luned-17-febbraio/14103;2020-02-16 14:32:21+00:00;36;89;@GiuseppeConteIT;#Agenda2023;
94;https://twitter.com/Palazzo_Chigi/status/1228375986485547010;Palazzo_Chigi;Il Presidente @GiuseppeConteIT e i Ministri @AzzolinaLucia e @peppeprovenzano hanno presentato a Gioia Tauro il Piano #Sud2030. Qui le slide, le foto, il video dell’evento e il testo dell’intervento del Presidente: http://governo.it/it/articolo/presentazione-del-piano-il-sud/14082;2020-02-14 17:50:31+00:00;22;51;@GiuseppeConteIT @AzzolinaLucia @peppeprovenzano;#Sud2030;
95;https://twitter.com/Palazzo_Chigi/status/1228286048280743936;Palazzo_Chigi;" In diretta da Gioia Tauro la presentazione del ""Piano per il Sud"" con il Presidente @GiuseppeConteIT, la Ministra @AzzolinaLucia e il Ministro @peppeprovenzano #Sud2030";2020-02-14 11:53:09+00:00;17;43;@GiuseppeConteIT @AzzolinaLucia @peppeprovenzano;#Sud2030;
96;https://twitter.com/Palazzo_Chigi/status/1228240504455741440;Palazzo_Chigi;La lettera del Presidente @GiuseppeConteIT al Quotidiano del Sud;2020-02-14 08:52:10+00:00;8;31;@GiuseppeConteIT;;
97;https://twitter.com/Palazzo_Chigi/status/1228097990633676800;Palazzo_Chigi;Il comunicato stampa del Consiglio dei Ministri n. 29:;2020-02-13 23:25:52+00:00;13;30;;;
98;https://twitter.com/Palazzo_Chigi/status/1228079711215071233;Palazzo_Chigi; In diretta la conferenza stampa del Presidente @GiuseppeConteIT e del Ministro @AlfonsoBonafede al termine del Consiglio dei Ministri n. 29;2020-02-13 22:13:14+00:00;46;147;@GiuseppeConteIT @AlfonsoBonafede;;
99;https://twitter.com/Palazzo_Chigi/status/1227977231923896320;Palazzo_Chigi; In diretta l'intervento del Presidente @GiuseppeConteIT al 73° anniversario della fondazione dell’Ucid;2020-02-13 15:26:01+00:00;17;79;@GiuseppeConteIT;;
100;https://twitter.com/Palazzo_Chigi/status/1227968539967004673;Palazzo_Chigi;Il Consiglio dei Ministri è convocato questa sera alle ore 20.00 a Palazzo Chigi. Qui l’ordine del giorno;2020-02-13 14:51:29+00:00;18;33;;;
101;https://twitter.com/Palazzo_Chigi/status/1227962062296559616;Palazzo_Chigi;Punto stampa del Presidente @GiuseppeConteIT Diretta;2020-02-13 14:25:44+00:00;38;96;@GiuseppeConteIT;;
102;https://twitter.com/Palazzo_Chigi/status/1227311689781202944;Palazzo_Chigi;Al via il Tavolo istituzionale del Cis Basilicata. Alla presenza del Presidente @GiuseppeConteIT si è svolta oggi pomeriggio a Palazzo Chigi la prima riunione del programma di sviluppo del territorio lucano. Il comunicato stampa:;2020-02-11 19:21:23+00:00;19;45;@GiuseppeConteIT;;
103;https://twitter.com/Palazzo_Chigi/status/1227288024817508354;Palazzo_Chigi;Domande sul #coronavirus? Visita il sito del @ministerosalute;2020-02-11 17:47:21+00:00;36;88;@MinisteroSalute;#coronavirus;
104;https://twitter.com/Palazzo_Chigi/status/1226926357491396609;Palazzo_Chigi;Il Presidente @GiuseppeConteIT ha partecipato in Senato alle celebrazioni in occasione del #GiornodelRicordo. Le foto, il video e il testo dell’intervento: http://governo.it/it/articolo/conte-interviene-alla-celebrazione-del-giorno-del-ricordo/14042;2020-02-10 17:50:13+00:00;19;42;@GiuseppeConteIT;#GiornodelRicordo;
105;https://twitter.com/Palazzo_Chigi/status/1226896506952847361;Palazzo_Chigi;Il Presidente @GiuseppeConteIT interviene alla cerimonia del #GiornodelRicordo in memoria di tutte le vittime delle foibe. In diretta dal Senato;2020-02-10 15:51:36+00:00;36;122;@GiuseppeConteIT;#GiornodelRicordo;
106;https://twitter.com/Palazzo_Chigi/status/1226857825974050816;Palazzo_Chigi;Coronavirus, tavolo interministeriale a Palazzo Chigi: il comunicato stampa;2020-02-10 13:17:54+00:00;37;108;;;
107;https://twitter.com/Palazzo_Chigi/status/1226510321390641154;Palazzo_Chigi;Gli impegni del Presidente @GiuseppeConteIT per la giornata di lunedì 10 febbraio ;2020-02-09 14:17:02+00:00;14;35;@GiuseppeConteIT;;
108;https://twitter.com/Palazzo_Chigi/status/1225883873399144448;Palazzo_Chigi;Si è insediato oggi, alla presenza del Presidente @GiuseppeConteIT, il Tavolo Istituzionale del Cis per la Città metropolitana di Cagliari e per la Provincia del Sud Sardegna. Parte così l’iter che porterà all'approvazione definitiva dei progetti. La nota:;2020-02-07 20:47:45+00:00;24;72;@GiuseppeConteIT;;
109;https://twitter.com/Palazzo_Chigi/status/1225872249137385479;Palazzo_Chigi;La nota congiunta della Presidenza del Consiglio, del @MEF_GOV e del @MISE_GOV sull'intesa tecnica raggiunta in data odierna fra i rappresentanti legali di ArcelorMittal e quelli di Ilva in Amministrazione Straordinaria:;2020-02-07 20:01:34+00:00;20;48;@MEF_GOV @MISE_GOV;;
110;https://twitter.com/Palazzo_Chigi/status/1225849617834741760;Palazzo_Chigi; In diretta l'intervento del Presidente @GiuseppeConteIT al convegno “Un nuovo bilancio europeo all'altezza delle sfide”;2020-02-07 18:31:38+00:00;11;27;@GiuseppeConteIT;;
111;https://twitter.com/Palazzo_Chigi/status/1225845447589289985;Palazzo_Chigi;Punto stampa del Presidente @GiuseppeConteIT Diretta;2020-02-07 18:15:04+00:00;19;85;@GiuseppeConteIT;;
112;https://twitter.com/Palazzo_Chigi/status/1225828746999058432;Palazzo_Chigi;Oggi il Presidente @GiuseppeConteIT ha incontrato il Presidente dell'Ucraina, @ZelenskyyUa. Il video dell’arrivo e le immagini: http://www.governo.it/it/articolo/conte-riceve-volodymyr-zelensky/14021 ;2020-02-07 17:08:42+00:00;13;33;@GiuseppeConteIT @ZelenskyyUa;;
113;https://twitter.com/Palazzo_Chigi/status/1225781873839869953;Palazzo_Chigi;Il Presidente @GiuseppeConteIT riceve a Palazzo Chigi il Presidente dell'Ucraina @ZelenskyyUa Diretta;2020-02-07 14:02:27+00:00;9;25;@GiuseppeConteIT @ZelenskyyUa;;
114;https://twitter.com/Palazzo_Chigi/status/1225525777803902977;Palazzo_Chigi;Il comunicato stampa del Consiglio dei Ministri n. 28;2020-02-06 21:04:49+00:00;8;36;;;
115;https://twitter.com/Palazzo_Chigi/status/1225475592772030464;Palazzo_Chigi;Punto stampa del Presidente @GiuseppeConteIT al termine della riunione al @DPCgov Diretta;2020-02-06 17:45:24+00:00;16;35;@GiuseppeConteIT @DPCgov;;
116;https://twitter.com/Palazzo_Chigi/status/1225437253528367107;Palazzo_Chigi;Il Presidente @GiuseppeConteIT al Senato per il Question Time (ripresa dei lavori dopo la sospensione della seduta) Diretta;2020-02-06 15:13:03+00:00;7;21;@GiuseppeConteIT;;
117;https://twitter.com/Palazzo_Chigi/status/1225421288182886401;Palazzo_Chigi;Il Presidente @GiuseppeConteIT al Senato per il Question Time Diretta;2020-02-06 14:09:36+00:00;6;18;@GiuseppeConteIT;;
118;https://twitter.com/Palazzo_Chigi/status/1225400066199953410;Palazzo_Chigi;Il Consiglio dei Ministri è convocato questo pomeriggio alle ore 17.00 a Palazzo Chigi. Qui l’ordine del giorno http://governo.it/it/articolo/convocazione-del-consiglio-dei-ministri-n-28/14004;2020-02-06 12:45:17+00:00;4;26;;;
119;https://twitter.com/Palazzo_Chigi/status/1225348702442807296;Palazzo_Chigi;"Il Presidente @GiuseppeConteIT interviene alla presentazione della campagna nazionale del @Moige_genitori ""#GiovaniAmbasciatori contro #Bullismo e Cyber Risk"" Diretta";2020-02-06 09:21:11+00:00;10;29;@GiuseppeConteIT @Moige_genitori;#GiovaniAmbasciatori #Bullismo;
120;https://twitter.com/Palazzo_Chigi/status/1225075779089981442;Palazzo_Chigi;Il Presidente @GiuseppeConteIT ha incontrato a Palazzo Chigi il Primo Ministro del Bangladesh, Sheikh Hasina . Il video dell’arrivo e le foto: http://www.governo.it/it/articolo/conte-incontra-il-primo-ministro-del-bangladesh/13991;2020-02-05 15:16:41+00:00;11;36;@GiuseppeConteIT;;
121;https://twitter.com/Palazzo_Chigi/status/1225027161058435074;Palazzo_Chigi;Il Presidente @GiuseppeConteIT accoglie a Palazzo Chigi il Primo Ministro del Bangladesh Sheikh Hasina in diretta;2020-02-05 12:03:29+00:00;19;47;@GiuseppeConteIT;;
122;https://twitter.com/Palazzo_Chigi/status/1224790554267062272;Palazzo_Chigi;Il Presidente @GiuseppeConteIT ha incontrato oggi pomeriggio a Bruxelles la Presidente della Commissione europea @vonderleyen, l'@eucopresident Michel e l'@EP_President Sassoli. Qui le foto dei bilaterali e il video del punto stampa:;2020-02-04 20:23:18+00:00;21;46;@GiuseppeConteIT @vonderleyen @eucopresident @EP_President;;
123;https://twitter.com/Palazzo_Chigi/status/1224740707895857152;Palazzo_Chigi;Punto stampa del Presidente @GiuseppeConteIT al termine del bilaterale con la Presidente della Commissione Ue @vonderleyen In diretta da Bruxelles;2020-02-04 17:05:14+00:00;28;86;@GiuseppeConteIT @vonderleyen;;
124;https://twitter.com/Palazzo_Chigi/status/1224705580792762369;Palazzo_Chigi;Il Presidente @GiuseppeConteIT ha partecipato a Londra all'evento di lancio della #COP26 e ha incontrato il Primo Ministro del Regno Unito, Boris Johnson. Tutte le immagini e il punto stampa: http://www.governo.it/it/articolo/conte-londra/13976;2020-02-04 14:45:39+00:00;6;33;@GiuseppeConteIT;#COP26;
125;https://twitter.com/Palazzo_Chigi/status/1224647298300465154;Palazzo_Chigi;Punto stampa del Presidente @GiuseppeConteIT dopo la presentazione di #COP26 e l’incontro con il Primo Ministro @BorisJohnson in diretta da Londra;2020-02-04 10:54:03+00:00;22;77;@GiuseppeConteIT @BorisJohnson;#COP26;
126;https://twitter.com/Palazzo_Chigi/status/1224570502750097409;Palazzo_Chigi;Nella giornata di oggi il Presidente @GiuseppeConteIT partecipa, a Londra, all'evento di lancio della #COP26. Nel pomeriggio, gli incontri a Bruxelles con i vertici delle istituzioni europee;2020-02-04 05:48:53+00:00;38;118;@GiuseppeConteIT;#COP26;
127;https://twitter.com/Palazzo_Chigi/status/1224436599389212674;Palazzo_Chigi;#Coronavirus, le misure adottate dal Governo dalle prime fasi dell’emergenza ad oggi. L'approfondimento:;2020-02-03 20:56:48+00:00;38;93;;#Coronavirus;
128;https://twitter.com/Palazzo_Chigi/status/1224431505679646720;Palazzo_Chigi;"Il Presidente @GiuseppeConteIT ha incontrato medici e ricercatori dell'istituto nazionale per le malattie infettive ""Lazzaro Spallanzani"", impegnati nell'emergenza del #coronavirus http://www.governo.it/it/articolo/il-presidente-conte-visita-listituto-spallanzani/13975";2020-02-03 20:36:34+00:00;77;302;@GiuseppeConteIT;#coronavirus;
129;https://twitter.com/Palazzo_Chigi/status/1224399656131747841;Palazzo_Chigi;Nella giornata di oggi il Presidente @GiuseppeConteIT ha ricevuto il Primo Ministro dell'Ungheria, Viktor Orban, e successivamente, il Principe Ereditario del Regno del Bahrein, Salman bin Hamad bin Isa Al Khalifa. Foto e video su http://governo.it;2020-02-03 18:30:00+00:00;33;132;@GiuseppeConteIT;;
130;https://twitter.com/Palazzo_Chigi/status/1224346663046852609;Palazzo_Chigi;Il Presidente @GiuseppeConteIT accoglie a Palazzo Chigi il Primo Ministro dell'Ungheria, Viktor Orban;2020-02-03 14:59:26+00:00;6;36;@GiuseppeConteIT;;
131;https://twitter.com/Palazzo_Chigi/status/1223710789208563714;Palazzo_Chigi;"Il Presidente @GiuseppeConteIT ha partecipato alla presentazione di ""Essere Mediterranei - Fratelli e cittadini del Mare Nostro“"". Le foto, il video e il testo dell'intervento";2020-02-01 20:52:42+00:00;22;44;@GiuseppeConteIT;;
132;https://twitter.com/Palazzo_Chigi/status/1223664609447555072;Palazzo_Chigi;"Il Presidente @GiuseppeConteIT interviene alla presentazione di ""Essere mediterranei - Fratelli e cittadini del Mare Nostro“ Diretta";2020-02-01 17:49:12+00:00;8;31;@GiuseppeConteIT;;
133;https://twitter.com/Palazzo_Chigi/status/1223646363449282568;Palazzo_Chigi;Il Presidente @GiuseppeConteIT ha partecipato al decennale di @ItaliaCamp. Le foto, il video e il testo dell'intervento;2020-02-01 16:36:41+00:00;13;27;@GiuseppeConteIT @ItaliaCamp;;
134;https://twitter.com/Palazzo_Chigi/status/1223577174709612548;Palazzo_Chigi;Il Presidente @GiuseppeConteIT interviene al convegno per il decennale di @ItaliaCamp In diretta da Fiumicino;2020-02-01 12:01:46+00:00;35;97;@GiuseppeConteIT @ItaliaCamp;;
