id;permalink;username;text;date;retweet;favorite;mentions;hashtag;geo
0;https://twitter.com/Palazzo_Chigi/status/1248311127517335553;Palazzo_Chigi;Il mondo ci sta aspettando. Restiamo distanti adesso per tornare presto a stare insieme #iorestoacasa;2020-04-09 18:05:39+00:00;131;354;;#iorestoacasa #iorestoacasa;
1;https://twitter.com/Palazzo_Chigi/status/1248253010326634496;Palazzo_Chigi;Il comunicato stampa del Consiglio dei Ministri n. 40:;2020-04-09 14:14:43+00:00;13;31;;;
2;https://twitter.com/Palazzo_Chigi/status/1247478431857684480;Palazzo_Chigi;Con il progetto #CiStoDentro @FamigliaGov dedica una sezione ai bambini e ai ragazzi che stanno a casa durante l’emergenza #coronavirus, con video, consigli e informazioni adatte anche ai più piccoli;2020-04-07 10:56:49+00:00;16;47;@FamigliaGov;#CiStoDentro #coronavirus;
3;https://twitter.com/Palazzo_Chigi/status/1247285224112893952;Palazzo_Chigi;Il comunicato stampa del Consiglio dei Ministri n. 39: http://governo.it/it/articolo/comunicato-stampa-del-consiglio-dei-ministri-n-39/14417;2020-04-06 22:09:05+00:00;52;115;;;
4;https://twitter.com/Palazzo_Chigi/status/1247229511034437644;Palazzo_Chigi;Conferenza stampa del Presidente @GiuseppeConteIT con i Ministri @gualtierieurope, @AzzolinaLucia e @SPatuanelli In diretta da Palazzo Chigi;2020-04-06 18:27:42+00:00;56;129;@GiuseppeConteIT @gualtierieurope @AzzolinaLucia @SPatuanelli;;
5;https://twitter.com/Palazzo_Chigi/status/1247154783955214336;Palazzo_Chigi;È online sul sito del Governo la sezione di approfondimento sul decreto #CuraItalia che raccoglie le informazioni utili per cittadini e imprese ;2020-04-06 13:30:46+00:00;107;166;;#CuraItalia;
6;https://twitter.com/Palazzo_Chigi/status/1247110123132198912;Palazzo_Chigi;In corso a Palazzo Chigi la riunione del Consiglio dei Ministri. Qui l'ordine del giorno:;2020-04-06 10:33:18+00:00;41;84;;;
7;https://twitter.com/Palazzo_Chigi/status/1246010766857252866;Palazzo_Chigi;La lettera del Presidente @GiuseppeConteIT alla Presidente della Commissione europea, Ursula von der Leyen, pubblicata su La Repubblica;2020-04-03 09:44:51+00:00;395;1365;@GiuseppeConteIT;;
8;https://twitter.com/Palazzo_Chigi/status/1245657324741513218;Palazzo_Chigi;L'intervista del Presidente @GiuseppeConteIT a Il Fatto Quotidiano;2020-04-02 10:20:24+00:00;34;99;@GiuseppeConteIT;;
9;https://twitter.com/Palazzo_Chigi/status/1245416328430792705;Palazzo_Chigi; In diretta da Palazzo Chigi la conferenza stampa del Presidente @GiuseppeConteIT;2020-04-01 18:22:46+00:00;72;156;@GiuseppeConteIT;;
10;https://twitter.com/Palazzo_Chigi/status/1245308764535865344;Palazzo_Chigi;L'intervista del Presidente @GiuseppeConteIT al quotidiano olandese De Telegraaf;2020-04-01 11:15:20+00:00;66;174;@GiuseppeConteIT;;
11;https://twitter.com/Palazzo_Chigi/status/1244926899501088769;Palazzo_Chigi;Oggi le bandiere italiane in tutti gli uffici pubblici sono esposte a mezz'asta in segno di lutto e vicinanza ai familiari delle vittime del #coronavirus e come segnale di partecipazione collettiva al cordoglio delle comunità più colpite;2020-03-31 09:57:57+00:00;660;2733;;#coronavirus;
12;https://twitter.com/Palazzo_Chigi/status/1244614492820066313;Palazzo_Chigi;La traduzione in italiano dell'intervista del Presidente @GiuseppeConteIT al quotidiano spagnolo El País;2020-03-30 13:16:33+00:00;24;81;@GiuseppeConteIT;;
13;https://twitter.com/Palazzo_Chigi/status/1243970009346592770;Palazzo_Chigi;Conferenza stampa del Presidente @GiuseppeConteIT con il Ministro @gualtierieurope e il Presidente dell’Anci @Antonio_Decaro In diretta da Palazzo Chigi;2020-03-28 18:35:36+00:00;74;130;@GiuseppeConteIT @gualtierieurope @Antonio_Decaro;;
14;https://twitter.com/Palazzo_Chigi/status/1243254230342930432;Palazzo_Chigi;La campagna “L’Italia è orgogliosa di voi. Grazie” è dedicata a tutti coloro che, in questo periodo, stanno rischiando la loro salute per dare il loro contributo al nostro Paese . Continuare a restare a casa rimane un modo concreto per ringraziarli #iorestoacasa;2020-03-26 19:11:21+00:00;681;2426;;#iorestoacasa #iorestoacasa;
15;https://twitter.com/Palazzo_Chigi/status/1243130474429628417;Palazzo_Chigi;Il testo della lettera del Presidente @GiuseppeConteIT ai cittadini delle regioni del Nord più colpite dall’epidemia:;2020-03-26 10:59:36+00:00;72;177;@GiuseppeConteIT;;
16;https://twitter.com/Palazzo_Chigi/status/1243101808224022528;Palazzo_Chigi;Informativa del Presidente @GiuseppeConteIT al Senato in merito all'emergenza Covid-19 In diretta da Palazzo Madama;2020-03-26 09:05:41+00:00;13;45;@GiuseppeConteIT;;
17;https://twitter.com/Palazzo_Chigi/status/1242861253149831176;Palazzo_Chigi; In diretta dalla Camera dei Deputati l'informativa del Presidente @GiuseppeConteIT in merito all'emergenza Covid-19;2020-03-25 17:09:48+00:00;70;140;@GiuseppeConteIT;;
18;https://twitter.com/Palazzo_Chigi/status/1242839423882010624;Palazzo_Chigi;Coronavirus, la lettera al @eucopresident Charles Michel, del Presidente @GiuseppeConteIT e dei leader di Belgio, Francia, Grecia, Irlanda, Lussemburgo, Portogallo, Slovenia e Spagna;2020-03-25 15:43:04+00:00;32;94;@eucopresident @GiuseppeConteIT;;
19;https://twitter.com/Palazzo_Chigi/status/1242556505519534080;Palazzo_Chigi;Il comunicato stampa del Consiglio dei Ministri n. 38: http://governo.it/it/articolo/comunicato-stampa-del-consiglio-dei-ministri-n-38/14376;2020-03-24 20:58:51+00:00;81;130;;;
20;https://twitter.com/Palazzo_Chigi/status/1242505927024168966;Palazzo_Chigi;Conferenza stampa del Presidente @GiuseppeConteIT al termine del Consiglio dei Ministri n. 38 Diretta;2020-03-24 17:37:52+00:00;115;234;@GiuseppeConteIT;;
21;https://twitter.com/Palazzo_Chigi/status/1242456490201485314;Palazzo_Chigi;In corso a Palazzo Chigi la riunione del Consiglio dei Ministri. Qui l'ordine del giorno:;2020-03-24 14:21:25+00:00;23;71;;;
22;https://twitter.com/Palazzo_Chigi/status/1242030306309390341;Palazzo_Chigi;L'intervista a La Stampa del Presidente @GiuseppeConteIT;2020-03-23 10:07:55+00:00;40;135;@GiuseppeConteIT;;
23;https://twitter.com/Palazzo_Chigi/status/1241491068606087169;Palazzo_Chigi;Dichiarazioni del Presidente @GiuseppeConteIT In diretta da Palazzo Chigi;2020-03-21 22:25:11+00:00;195;399;@GiuseppeConteIT;;
24;https://twitter.com/Palazzo_Chigi/status/1239981638387466240;Palazzo_Chigi;Uniti ce la faremo ;2020-03-17 18:27:14+00:00;1799;8044;;;
25;https://twitter.com/Palazzo_Chigi/status/1239968292703318016;Palazzo_Chigi;Infrastrutture e politiche di coesione, il CIPE approva la Ragusa-Catania e stanzia risorse per il reddito energetico e il Ponte di Buriano;2020-03-17 17:34:13+00:00;18;43;;;
26;https://twitter.com/Palazzo_Chigi/status/1239675644545585156;Palazzo_Chigi;Il comunicato stampa del Consiglio dei Ministri n. 37:;2020-03-16 22:11:20+00:00;108;168;;;
27;https://twitter.com/Palazzo_Chigi/status/1239670442857725954;Palazzo_Chigi;Coronavius, conversazione telefonica tra il Presidente @GiuseppeConteIT e il Presidente della Repubblica Popolare Cinese, Xi Jinping;2020-03-16 21:50:40+00:00;54;195;@GiuseppeConteIT;;
28;https://twitter.com/Palazzo_Chigi/status/1239549002972114945;Palazzo_Chigi;Conferenza stampa del Presidente @GiuseppeConteIT e dei Ministri @gualtierieurope e @CatalfoNunzia al termine del Consiglio dei Ministri n. 37 #Coronavirus In diretta da Palazzo Chigi;2020-03-16 13:48:06+00:00;127;214;@GiuseppeConteIT @gualtierieurope @CatalfoNunzia;#Coronavirus;
29;https://twitter.com/Palazzo_Chigi/status/1238413268823277570;Palazzo_Chigi;In corso a Palazzo Chigi la videoconferenza del Presidente @GiuseppeConteIT con i Ministri @CatalfoNunzia, @gualtierieurope, @SPatuanelli e @robersperanza per discutere con le parti sociali dei protocolli di sicurezza a tutela della salute dei lavoratori;2020-03-13 10:35:06+00:00;153;729;@GiuseppeConteIT @CatalfoNunzia @gualtierieurope @SPatuanelli @robersperanza;;
30;https://twitter.com/Palazzo_Chigi/status/1238198961908973568;Palazzo_Chigi;Sono online le nuove risposte alle domande più frequenti sull'ultimo Decreto firmato dal Presidente @GiuseppeConteIT per il contenimento del Coronavirus ;2020-03-12 20:23:31+00:00;300;387;@GiuseppeConteIT;;
31;https://twitter.com/Palazzo_Chigi/status/1238141120049184768;Palazzo_Chigi;Il Presidente @GiuseppeConteIT e la Cancelliera Merkel hanno avuto questa mattina una lunga conversazione telefonica dedicata interamente all’emergenza Coronavirus;2020-03-12 16:33:41+00:00;152;776;@GiuseppeConteIT;;
32;https://twitter.com/Palazzo_Chigi/status/1237884780353478657;Palazzo_Chigi;Il Presidente @GiuseppeConteIT ha firmato il nuovo Dpcm recante ulteriori misure in materia di contenimento e gestione dell'emergenza epidemiologica da COVID-19 sull'intero territorio nazionale. Qui il testo del provvedimento:;2020-03-11 23:35:05+00:00;255;536;@GiuseppeConteIT;;
33;https://twitter.com/Palazzo_Chigi/status/1237842053007982595;Palazzo_Chigi; In diretta da Palazzo Chigi le dichiarazioni del Presidente @GiuseppeConteIT;2020-03-11 20:45:18+00:00;242;486;@GiuseppeConteIT;;
34;https://twitter.com/Palazzo_Chigi/status/1237832465248669696;Palazzo_Chigi;Il Presidente @GiuseppeConteIT e la Presidente della Commissione Europea @vonderleyen nel pomeriggio hanno avuto una video-conferenza sull'emergenza coronavirus. Qui il comunicato stampa congiunto: http://governo.it/it/articolo/videoconferenza-conte-von-der-leyen/14292;2020-03-11 20:07:12+00:00;42;159;@GiuseppeConteIT @vonderleyen;;
35;https://twitter.com/Palazzo_Chigi/status/1237733497537781760;Palazzo_Chigi;Il comunicato stampa del Consiglio dei Ministri n. 36 http://governo.it/it/articolo/comunicato-stampa-del-consiglio-dei-ministri-n-36/14289;2020-03-11 13:33:56+00:00;30;53;;;
36;https://twitter.com/Palazzo_Chigi/status/1237679811377627137;Palazzo_Chigi; Dichiarazioni alla stampa del Presidente @GiuseppeConteIT in diretta da Palazzo Chigi;2020-03-11 10:00:36+00:00;67;130;@GiuseppeConteIT;;
37;https://twitter.com/Palazzo_Chigi/status/1237643433726091264;Palazzo_Chigi;Il Consiglio dei Ministri è convocato questa mattina a Palazzo Chigi. Qui l'ordine del giorno: http://www.governo.it/it/articolo/convocazione-del-consiglio-dei-ministri-n-36/14286;2020-03-11 07:36:03+00:00;18;41;;;
38;https://twitter.com/Palazzo_Chigi/status/1237452592340520960;Palazzo_Chigi;Decreto #IoRestoACasa, domande frequenti sulle misure adottate dal Governo;2020-03-10 18:57:43+00:00;771;885;;#IoRestoACasa #IoRestoACasa;
39;https://twitter.com/Palazzo_Chigi/status/1237399796379529217;Palazzo_Chigi;In relazione al Covid-19 e alle possibili misure di ordine europeo, il Presidente @GiuseppeConteIT ha avuto stamani dei colloqui telefonici con la Presidente della Commissione Europea @vonderleyen e con il Presidente Charles Michel @eucopresident http://www.governo.it/it/articolo/conte-colloqui-telefonici-con-ursula-von-der-leyen-e-charles-michel/14280;2020-03-10 15:27:55+00:00;39;108;@GiuseppeConteIT @vonderleyen @eucopresident;;
40;https://twitter.com/Palazzo_Chigi/status/1237367889717592072;Palazzo_Chigi;Alcune risposte alle domande frequenti sulle ultime misure adottate dal Governo per contrastare l’emergenza Coronavirus #iorestoacasa http://www.governo.it/it/articolo/decreto-iorestoacasa-domande-frequenti-sulle-misure-adottate-dal-governo/14278;2020-03-10 13:21:08+00:00;560;664;;#iorestoacasa #iorestoacasa;
41;https://twitter.com/Palazzo_Chigi/status/1237149695929188352;Palazzo_Chigi;Il Presidente @GiuseppeConteIT ha firmato il Dpcm 9 marzo 2020 recante nuove misure per il contenimento e il contrasto del diffondersi del virus Covid-19 sull'intero territorio nazionale;2020-03-09 22:54:07+00:00;439;810;@GiuseppeConteIT;;
42;https://twitter.com/Palazzo_Chigi/status/1237115039364067328;Palazzo_Chigi;Dichiarazioni alla stampa del Presidente @GiuseppeConteIT In diretta da Palazzo Chigi;2020-03-09 20:36:24+00:00;484;759;@GiuseppeConteIT;;
43;https://twitter.com/Palazzo_Chigi/status/1236959971889352705;Palazzo_Chigi;L'intervista del Presidente @GiuseppeConteIT a La Repubblica:;2020-03-09 10:20:13+00:00;130;399;@GiuseppeConteIT;;
44;https://twitter.com/Palazzo_Chigi/status/1236586246450884608;Palazzo_Chigi;Il decreto è consultabile anche da qui:;2020-03-08 09:35:10+00:00;36;47;;;
45;https://twitter.com/Palazzo_Chigi/status/1236484855904350208;Palazzo_Chigi;Il Presidente del Consiglio @GiuseppeConteIT ha appena firmato il nuovo Dpcm recante ulteriori misure per il contenimento e il contrasto del diffondersi del virus Covid-19 sull'intero territorio nazionale;2020-03-08 02:52:17+00:00;479;801;@GiuseppeConteIT;;
46;https://twitter.com/Palazzo_Chigi/status/1236460908051922951;Palazzo_Chigi;Conferenza stampa del Presidente @GiuseppeConteIT Diretta;2020-03-08 01:17:07+00:00;202;274;@GiuseppeConteIT;;
47;https://twitter.com/Palazzo_Chigi/status/1236091073145028610;Palazzo_Chigi;Il comunicato stampa del Consiglio dei Ministri n.35;2020-03-07 00:47:31+00:00;56;84;;;
48;https://twitter.com/Palazzo_Chigi/status/1235970205576294400;Palazzo_Chigi;Anche Palazzo Chigi aderisce a #MilluminoDiMeno, la Giornata del risparmio energetico e degli stili di vita sostenibili. Questa sera le luci della facciata esterna rimarranno spente dalle 20 alle 22;2020-03-06 16:47:14+00:00;25;103;;#MilluminoDiMeno;
49;https://twitter.com/Palazzo_Chigi/status/1235615444612132864;Palazzo_Chigi;Il comunicato stampa del Consiglio dei Ministri n. 34: http://governo.it/it/articolo/comunicato-stampa-del-consiglio-dei-ministri-n-34/14247;2020-03-05 17:17:33+00:00;25;48;;;
50;https://twitter.com/Palazzo_Chigi/status/1235588384711749632;Palazzo_Chigi; In diretta la conferenza stampa del Presidente @GiuseppeConteIT e del Ministro @gualtierieurope;2020-03-05 15:30:01+00:00;59;225;@GiuseppeConteIT @gualtierieurope;;
51;https://twitter.com/Palazzo_Chigi/status/1235539141670178816;Palazzo_Chigi;In corso la riunione del Consiglio dei Ministri. Qui l’ordine del giorno:;2020-03-05 12:14:21+00:00;12;39;;;
52;https://twitter.com/Palazzo_Chigi/status/1235325289909104643;Palazzo_Chigi;Il Presidente @GiuseppeConteIT ha firmato un nuovo Dpcm con misure riguardanti il contrasto e il contenimento sull'intero territorio nazionale del diffondersi del #Coronavirus. Qui il testo: http://governo.it/it/articolo/coronavirus-firmato-il-dpcm-4-marzo-2020/14241;2020-03-04 22:04:35+00:00;284;560;@GiuseppeConteIT;#Coronavirus;
53;https://twitter.com/Palazzo_Chigi/status/1235251955452325890;Palazzo_Chigi;#Coronavirus, dichiarazioni alla stampa del Presidente @GiuseppeConteIT e del Ministro @AzzolinaLucia In diretta da Palazzo Chigi;2020-03-04 17:13:10+00:00;134;246;@GiuseppeConteIT @AzzolinaLucia;#Coronavirus;
54;https://twitter.com/Palazzo_Chigi/status/1234408805850648578;Palazzo_Chigi; In diretta la presentazione della “Relazione sulla politica dell’informazione per la sicurezza”, curata dal Comparto Intelligence;2020-03-02 09:22:48+00:00;29;59;;;
55;https://twitter.com/Palazzo_Chigi/status/1234213549586685953;Palazzo_Chigi;Il Presidente @GiuseppeConteIT ha firmato il Dpcm che proroga alcune delle misure già adottate per la gestione dell'emergenza coronavirus e ne introduce ulteriori volte a disciplinare in modo unitario gli interventi su tutto il territorio nazionale: http://governo.it/it/articolo/coronavirus-firmato-il-dpcm-1-marzo-2020/14210;2020-03-01 20:26:55+00:00;230;349;@GiuseppeConteIT;;
56;https://twitter.com/Palazzo_Chigi/status/1234051318479826944;Palazzo_Chigi;L'intervista del Presidente @GiuseppeConteIT a il Fatto Quotidiano:;2020-03-01 09:42:16+00:00;105;284;@GiuseppeConteIT;;
57;https://twitter.com/Palazzo_Chigi/status/1233544073673347074;Palazzo_Chigi;Il comunicato stampa del Consiglio dei Ministri n. 33: http://governo.it/it/articolo/comunicato-stampa-del-consiglio-dei-ministri-n-33/14204;2020-02-29 00:06:39+00:00;62;106;;;
58;https://twitter.com/Palazzo_Chigi/status/1233472449003556864;Palazzo_Chigi;Conferenza stampa del Ministro dell'economia e delle finanze @gualtierieurope Diretta;2020-02-28 19:22:03+00:00;10;31;@gualtierieurope;;
59;https://twitter.com/Palazzo_Chigi/status/1233453572743946243;Palazzo_Chigi;Il Consiglio dei Ministri è convocato questa sera alle ore 19.30 a Palazzo Chigi. Qui l'ordine del giorno: http://governo.it/it/articolo/convocazione-del-consiglio-dei-ministri-n-33/14199;2020-02-28 18:07:02+00:00;17;41;;;
60;https://twitter.com/Palazzo_Chigi/status/1233128600930594819;Palazzo_Chigi;Il Presidente @GiuseppeConteIT ha partecipato a Napoli al XXXV Vertice intergovernativo italo-francese. Dopo lo scambio di intese, la conferenza stampa con il Presidente francese @EmmanuelMacron. Le foto, i video, la dichiarazione congiunta http://www.governo.it/it/articolo/xxxv-vertice-intergovernativo-italo-francese/14153;2020-02-27 20:35:43+00:00;54;123;@GiuseppeConteIT @EmmanuelMacron;;
61;https://twitter.com/Palazzo_Chigi/status/1233095546853842945;Palazzo_Chigi;Vertice intergovernativo italo-francese la cerimonia di scambio di intese e la conferenza stampa del Presidente @GiuseppeConteIT e del Presidente della Repubblica francese @EmmanuelMacron In diretta da Napoli;2020-02-27 18:24:22+00:00;52;173;@GiuseppeConteIT @EmmanuelMacron;;
62;https://twitter.com/Palazzo_Chigi/status/1233047852445786112;Palazzo_Chigi;Il Presidente @GiuseppeConteIT accoglie a Piazza del Plebiscito il Presidente della Repubblica francese @EmmanuelMacron per il Vertice intergovernativo italo-francese In diretta da Napoli;2020-02-27 15:14:51+00:00;24;71;@GiuseppeConteIT @EmmanuelMacron;;
63;https://twitter.com/Palazzo_Chigi/status/1232743242334121984;Palazzo_Chigi;Domani, giovedì 27 febbraio, si terrà a Napoli il XXXV Vertice intergovernativo italo-francese presieduto dal Presidente @GiuseppeConteIT e dal Presidente della Repubblica francese @EmmanuelMacron Qui il programma:;2020-02-26 19:04:26+00:00;46;100;@GiuseppeConteIT @EmmanuelMacron;;
64;https://twitter.com/Palazzo_Chigi/status/1232726298700677121;Palazzo_Chigi;"""Aiutiamoci l’un con l’altro. Insieme ce la facciamo"" è lo spot realizzato da Rai e Presidenza del Consiglio dei Ministri per il @MinisteroSalute al fine di sensibilizzare tutti sulle buone pratiche quotidiane che aiutano a contenere il rischio contagio da #coronavirus #Covid19";2020-02-26 17:57:07+00:00;36;85;@MinisteroSalute;#coronavirus #Covid19;
65;https://twitter.com/Palazzo_Chigi/status/1232599207766302720;Palazzo_Chigi;"#Coronavirus, intervista del Presidente @GiuseppeConteIT al ""Corriere della Sera""";2020-02-26 09:32:06+00:00;71;209;@GiuseppeConteIT;#Coronavirus;
66;https://twitter.com/Palazzo_Chigi/status/1232420645717323776;Palazzo_Chigi;Il comunicato stampa del Consiglio dei Ministri n. 32;2020-02-25 21:42:33+00:00;14;37;;;
67;https://twitter.com/Palazzo_Chigi/status/1232384017376346113;Palazzo_Chigi;In corso a Palazzo Chigi il Consiglio dei Ministri n. 32. Qui l'ordine del giorno;2020-02-25 19:17:00+00:00;16;43;;;
68;https://twitter.com/Palazzo_Chigi/status/1232265570374082560;Palazzo_Chigi;Le decisioni e le misure adottate dal governo vengono comunicate esclusivamente attraverso i canali e le fonti ufficiali, alle quali si prega di far riferimento;2020-02-25 11:26:21+00:00;195;540;;;
69;https://twitter.com/Palazzo_Chigi/status/1232265568239210496;Palazzo_Chigi;La Presidenza del Consiglio smentisce le notizie che stanno circolando in queste ore su una presunta chiusura, per decisione del Presidente @GiuseppeConteIT, di tutte le scuole di ogni ordine e grado.;2020-02-25 11:26:20+00:00;772;1496;@GiuseppeConteIT;;
70;https://twitter.com/Palazzo_Chigi/status/1232027216558592002;Palazzo_Chigi;Punto stampa del Presidente @GiuseppeConteIT #coronavirus #COVID19italia in diretta dal @dpcGov;2020-02-24 19:39:13+00:00;20;39;@GiuseppeConteIT @DPCgov;#coronavirus #COVID19italia;
71;https://twitter.com/Palazzo_Chigi/status/1231898121933873153;Palazzo_Chigi; In diretta dalla sede della @dpcGov, la conferenza stampa di aggiornamento da parte del Commissario Borrelli sull’emergenza #coronavirus #COVID19italia;2020-02-24 11:06:14+00:00;42;139;@DPCgov;#coronavirus #COVID19italia;
72;https://twitter.com/Palazzo_Chigi/status/1231368458161598464;Palazzo_Chigi;#Coronavirus, il comunicato stampa del Consiglio dei Ministri n. 31: http://governo.it/it/articolo/comunicato-stampa-del-consiglio-dei-ministri-n-31/14163;2020-02-23 00:01:32+00:00;72;109;;#Coronavirus;
73;https://twitter.com/Palazzo_Chigi/status/1231338797306204170;Palazzo_Chigi; #Coronavirus, conferenza stampa al termine del Consiglio dei Ministri al @DPCgov in seguito al vertice del Comitato operativo presieduto dal Presidente @GiuseppeConteIT;2020-02-22 22:03:41+00:00;208;415;@DPCgov @GiuseppeConteIT;#Coronavirus;
74;https://twitter.com/Palazzo_Chigi/status/1231193622156062720;Palazzo_Chigi;#Coronavirus, in corso la riunione del Comitato operativo presieduta dal Presidente @GiuseppeConteIT al @DPCgov. Al termine è prevista una conferenza stampa http://governo.it/it/articolo/coronavirus-vertice-alla-protezione-civile-con-il-presidente-conte/14159;2020-02-22 12:26:48+00:00;144;435;@GiuseppeConteIT @DPCgov;#Coronavirus;
75;https://twitter.com/Palazzo_Chigi/status/1230951617530339329;Palazzo_Chigi;Il Presidente @GiuseppeConteIT ha partecipato a Bruxelles al Consiglio europeo straordinario sul negoziato del Quadro Finanziario Pluriennale dell’Unione europea. Foto e video: http://governo.it/it/articolo/conte-bruxelles/14149;2020-02-21 20:25:10+00:00;12;47;@GiuseppeConteIT;;
76;https://twitter.com/Palazzo_Chigi/status/1230929580833300492;Palazzo_Chigi;Punto stampa del Presidente @GiuseppeConteIT al termine del Consiglio europeo straordinario #EUCO In diretta da Bruxelles ;2020-02-21 18:57:36+00:00;9;32;@GiuseppeConteIT;#EUCO;
77;https://twitter.com/Palazzo_Chigi/status/1230849241154805762;Palazzo_Chigi;Il comunicato stampa del Consiglio dei Ministri n. 30: http://governo.it/it/articolo/comunicato-stampa-del-consiglio-dei-ministri-n-30/14155;2020-02-21 13:38:21+00:00;6;22;;;
78;https://twitter.com/Palazzo_Chigi/status/1230840736440082432;Palazzo_Chigi;#Coronavirus: le misure adottate dal @MinisteroSalute dopo le segnalazioni di nuovi casi http://www.salute.gov.it/portale/nuovocoronavirus/dettaglioComunicatiNuovoCoronavirus.jsp?lingua=italiano&ampid=5451;2020-02-21 13:04:34+00:00;23;38;@MinisteroSalute;#Coronavirus;
79;https://twitter.com/Palazzo_Chigi/status/1230804894640148481;Palazzo_Chigi;Punto stampa del Presidente @GiuseppeConteIT nella seconda giornata del Consiglio Europeo straordinario #EUCO in diretta da Bruxelles;2020-02-21 10:42:08+00:00;6;24;@GiuseppeConteIT;#EUCO;
80;https://twitter.com/Palazzo_Chigi/status/1230802048783962112;Palazzo_Chigi;In corso a Palazzo Chigi il Consiglio dei Ministri n. 30. Qui l'ordine del giorno;2020-02-21 10:30:50+00:00;7;37;;;
81;https://twitter.com/Palazzo_Chigi/status/1230496712457936896;Palazzo_Chigi;Punto stampa del Presidente @GiuseppeConteIT In diretta da Bruxelles;2020-02-20 14:17:32+00:00;34;90;@GiuseppeConteIT;;
82;https://twitter.com/Palazzo_Chigi/status/1230482113524359170;Palazzo_Chigi;Il Presidente @GiuseppeConteIT ha incontrato a Palazzo Chigi il Presidente della Repubblica dell'Azerbaigian, Ilham Aliyev @presidentaz. Le foto e i video: http://governo.it/it/articolo/conte-incontra-il-presidente-della-repubblica-dellazerbaigian/14147;2020-02-20 13:19:31+00:00;40;97;@GiuseppeConteIT @presidentaz;;
83;https://twitter.com/Palazzo_Chigi/status/1230443386701860866;Palazzo_Chigi;Incontro tra il Presidente @GiuseppeConteIT e il Presidente della Repubblica dell'Azerbaigian, Ilham Aliyev @presidentaz In diretta la cerimonia di scambio di intese ;2020-02-20 10:45:38+00:00;12;40;@GiuseppeConteIT @presidentaz;;
84;https://twitter.com/Palazzo_Chigi/status/1230432745043656704;Palazzo_Chigi;Il Presidente @GiuseppeConteIT accoglie il Presidente della Repubblica dell'Azerbaigian, Ilham Aliyev @presidentaz Diretta;2020-02-20 10:03:21+00:00;5;24;@GiuseppeConteIT @presidentaz;;
85;https://twitter.com/Palazzo_Chigi/status/1230148359236837377;Palazzo_Chigi;Le comunicazioni del Presidente @GiuseppeConteIT in vista del Consiglio europeo straordinario del 20 febbraio #EUCO In diretta dalla Camera dei Deputati;2020-02-19 15:13:18+00:00;4;28;@GiuseppeConteIT;#EUCO;
86;https://twitter.com/Palazzo_Chigi/status/1230141510227808256;Palazzo_Chigi;Cerimonia di firma del Protocollo d’intesa fra la Presidenza del Consiglio e la Banca Europea per gli Investimenti alla presenza del Presidente @GiuseppeConteIT In diretta da Palazzo Chigi;2020-02-19 14:46:05+00:00;31;118;@GiuseppeConteIT;;
87;https://twitter.com/Palazzo_Chigi/status/1230047777213861888;Palazzo_Chigi;Le comunicazioni del Presidente @GiuseppeConteIT in vista del Consiglio europeo straordinario del 20 febbraio #EUCO in diretta dal Senato;2020-02-19 08:33:37+00:00;8;33;@GiuseppeConteIT;#EUCO;
88;https://twitter.com/Palazzo_Chigi/status/1230011191285735424;Palazzo_Chigi;Nella giornata di oggi, mercoledì 19 febbraio, il Presidente @GiuseppeConteIT sarà in Senato (ore 9.30) e alla Camera (ore 16) per delle comunicazioni in vista del Consiglio europeo straordinario del 20 febbraio;2020-02-19 06:08:15+00:00;44;202;@GiuseppeConteIT;;
89;https://twitter.com/Palazzo_Chigi/status/1229795555544633346;Palazzo_Chigi;Il Presidente @GiuseppeConteIT ha incontrato il Primo Ministro della Regione autonoma del Kurdistan iracheno, @masrour_barzani. La nota e le immagini dell’incontro: http://www.governo.it/it/articolo/conte-incontra-masrour-barzani/14111;2020-02-18 15:51:23+00:00;59;458;@GiuseppeConteIT @masrour_barzani;;
90;https://twitter.com/Palazzo_Chigi/status/1229737252005257216;Palazzo_Chigi;#BonusFacciate, dall'@Agenzia_Entrate i chiarimenti e una guida all'uso del beneficio;2020-02-18 11:59:42+00:00;17;29;@Agenzia_Entrate;#BonusFacciate;
